article_title,name,native_name,native_name_lang,other_name,logo,caption,dates,leader,motives,area,ideology,crimes,attacks,status,position,size,revenue,financing,url,allies,website,country,flag,allegiance,headquarters,battles,successor,foundation,predecessor,article_title
Pemuda Pancasila,Pemuda Pancasila,,,,160px,Logo Pemuda Pancasila,1965–Sekarang,Japto Soerjosoemarno,,Indonesia,Anti-komunismePancasilaUltranasionalisme,TawuranPembantaianPemancunganSiksaan dan Premanisme,Pembantaian di Indonesia 1965–1966Konflik sektarian Maluku,Aktif,Kanan-jauh,"3,000,000 (2012)",,,,,,,,,,,,,,Pemuda Pancasila
Aitarak,Aitarak,,,,Flag of AITARAK.svg,,,Eurico Guterres,Mencegah kemerdekaan Timor Timur,Timor Leste,,"Pembantaian Gereja Liquiçá
 Pembantaian Rumah Manuel Carrascalão
 Pembantaian Gereja Suai",Kampanye Bumi Hangus Timor Timur,Ditutup,Sayap-kanan,,,,,,,Timor Leste (dulu sebagai provinsi di Indonesia bernama Timor Timur),,,"Dili, Timor Timur",,,,,Aitarak
Ikatan Pemuda Karya,Ikatan Pemuda Karya,,,IPK,,,,Olo Panggabean (1969-2009)  Budi Panggabean (2009-sekarang),,Indonesia,Anti-komunismePancasila,"Pemancungan, Siksaan",,,,"4,000,000 (2009)",,,,,,,,,,,,,,Ikatan Pemuda Karya
Pasukan Internasional Timor Timur,International Force East Timor,,,INTERFET,INTERFET Logo.jpg,Logo INTERFET,–,Mayor Jenderal Peter Cosgrove,,,,,,Menyerahkan komando operasi militer kepada UNTAET,,11.500 personel (pada puncak penerapan),,,,,,Lihat daftar,,,,Krisis Timor Timur 1999,UNTAET,,,Pasukan Internasional Timor Timur
