Mashuri Saleh,,Mashuri Saleh,"Aankomst Minister Mashuri (kop) van O.V. en W. in Indonesie op Schiphol, Bestanddeelnr 921-7871.jpg",Mashuri Saleh (1968),Wakil Ketua Majelis Permusyawaratan Rakyat Republik IndonesiaUtusan Golongan,,1 Oktober 1977,1 Oktober 1982,Soeharto,Sumiskum,Amir Murtono,Menteri Pendidikan dan Kebudayaan Indonesia,ke-14,6 Juni 1968,28 Maret 1973,Soeharto,Sanusi Hardjadinata,Sumantri Brodjonegoro,Menteri Perguruan Tinggi dan Ilmu Pengetahuan Indonesia,ke-5,27 Maret 1966,25 Juli 1966,Soekarno,Syarief Thayeb (ad-interim),Tidak Ada; Jabatan dihapuskan,,,,,,,,,,,,,,,,,,,,,,,,,,,,"Juwana, Pati, Jawa Tengah,Hindia Belanda",,"Surakarta, Jawa Tengah,Indonesia",,,,,,Islam,,,,,,,,,,,Maskanan (saudara kandung),,,Ketua MPR/DPR,,,,,,,,,,,,,,,,,,,,,,,,,,,,,,,,,,,,,,,,Soedharmono (ad-interim),,,,,,,,,,,,,,,,,,,,,,,,,,,,,,,,,,,,,,,28 Maret 1973,,,,,,,,,,,,,,,,,,,Menteri Penerangan Indonesia,,,,,,,,,,,,,,,ke-20,,,,,,,,,,,,,,,,,,,,,,,,Soeharto,,,,,,,200px,,,,,,,,,,,,,,,,,,,,,,,,,,,,,,,,,,,,,,,Boediarjo,,,,,,,,,,,Adam Malik (1977–78) Daryatmo (1978–82),1 Oktober 1977,Mashuri Saleh
Fuad Bawazier,Dr.,,Fuad Bawazier.jpg,,Menteri Keuangan Indonesia,ke-19,16 Maret 1998,21 Mei 1998,Soeharto,Mar'ie Muhammad,Bambang Subianto,,,,,,,,,,,,,,,,,,,,,,,,,,,,,,,,,,,,,,,,,,"Tegal, Jawa Tengah, Indonesia",,,,Golkar (–1998) PAN (1998–2006) Hanura (2006–14) Partai Gerindra (2015–),Soerjati,Muhammad Haikal BawazierNora BawazierMohammad Yamin,,Islam,,,,,,,,,,,,,,,,,,,,,,,,,,,,,,,,,,,,,,,,,,,,,,,,,,,,,,,,,,,,,,,,,,,,,,,,,,,,,,,,,,,,,,,,,,,,,,,,,,,,,,,,,,,,,,,,,,,,,,,,,,,,,,,,,,,,,,,,,Politisi,,,,,,,,,,,,,,,,,,,,,,,,Bacharuddin Jusuf Habibie,,,,,,,,,,,,,,,,,,,,,,,,,,,,,SMA Negeri 1 Cilacap Universitas Gadjah MadaWilliam CollegeUniversity of Maryland,,,,,,,,,,,,,,,,,,,,Fuad Bawazier
Frans Seda,,,Indonesia Ambassador to Belgium Frans Seda.jpg,,Menteri Perhubungan Indonesia,ke-25,6 Juni 1968,28 Maret 1973,Soeharto,Salimin Prawiro Sumarto,Basuki Rachmat,Menteri Keuangan Indonesia,ke-14,25 Juli 1966,6 Juni 1968,Soekarno,Sumarno,Ali Wardhana,Menteri Pertanian Indonesia,ke-14,24 Februari 1966,25 Juli 1966,Soekarno,Sukarno,Sutjipto,,,,,,,,,,,,,,,,,,,,,,,,,,,,"Maumere, Nusa Tenggara Timur, Hindia Belanda",,"Jakarta, Indonesia",,Partai Katolik PDIPDI-P,Johanna Maria Pattinaja,2,,,,,,,,,,,,,,,,,,,,,,,,,,,,,,,,,,,,,,,,,,,,,,Jl. Metro Kencana V Nomor 5,,,,,,,,,,,,,,,,,,,,,,,,,,,,,,,,,,,,,,,,,,,,,,,,,,,,,,,,,,,,,,,,,,,,,,,,,,,,,,,,,,,,,,,,San Diego Hills,,,,,,,,,,,,,,,,,,,,,,,,,,,,,,,,,,,,,,,,,,,,,,,,,,,,,,,,,,Hollandsche BurgerschoolKatolieke Economische Hogeschool,,,,,,,,,,,,,,,,,,,,Frans Seda
Ali Sadikin,,Ali Sadikin,Ali_Sadikin_(1975).jpg,Ali Sadikin pada tahun 1975,,,,,,,,Menteri Perhubungan IndonesiaMenteri Perhubungan Laut Indonesia,ke-16,13 November 1963,28 Maret 1966,Soekarno,Abdoelmoettalip Danoeningrat,Susatyo Mardi,Gubernur Daerah Khusus Ibukota Jakarta,ke-7,28 April 1966,Juli 1977,,Dr. Soemarno,Tjokropranolo,1977,1981,,Moehono,Sjarnoebi Said,,,,,,,,,,,,,,,,,,,,,,,"Sumedang, Jawa Barat, Hindia Belanda",,Singapura,,,,5,Tentara,,Signature of Ali Sadikin.svg,,,25px TNI Angkatan Laut,1945—1966,25px Letnan Jenderal TNI,,KKO,Revolusi Nasional Indonesia,,,,,,,,,,,,,,,,,,,,,,,,,,,,,,,,,,,,,Ketua Umum Persatuan Sepak Bola Seluruh Indonesia ke-8,Raden Sadikin,,,,,,,Jatidjan,,,,,,,Ali Sadikin,,,,,,,,,,,,,,,,,,,,,,,,,,,,,,,,27 Agustus 1964,,,,,,,,,,,,,,,,,,,Daftar Menteri Koordinator Bidang Kemaritiman IndonesiaMenteri Koordinator Kompartemen Kemaritiman Indonesia,,,,,,,,,,,,,,,ke-1,,,,,,,,,,,,,,,,,,,,,,,,Soekarno,,,,,Itjih Karnasih,,,,,,,,,,,,,,,,,,,,,,,,,,,,,,,,,,,,,,,,,Tidak Ada,,,,,,,,,,,,28 Maret 1966,Ali Sadikin
Siti Hardijanti Rukmana,,Siti Hardijanti Rukmana,"Tutut Soeharto, Antara TV, 00.35.jpg",,,,,,,,,Menteri Sosial Indonesia ke-23,,14 Maret 1998,21 Mei 1998,Soeharto,Endang Kusuma Inten Soeweno,Justika Baharsjah,Ketua Umum Palang Merah Indonesia,ke-10,1992,1998,,Ibnu Sutowo,Mar'ie Muhammad,1 Oktober 1992,14 Maret 1998,,,,Direktur Utama TPI ke-1,,23 Januari 1991,23 Januari 1998,,jabatan baru,Tito Sulistio,,,,,,,,,,,,,,,,"Yogyakarta, Indonesia",,,Indonesia,(sampai 1998) (2002–14) (sejak 2018),Indra Rukmana (m. 1972),3,,,,Mbak Tutut,,,,,,,,Bintang Mahaputera Pratama,,,,,,,,,,,,,,,,,,,,,,,,,,,,,,,,,,,,Anggota MPR RI Fraksi Golkar,,,,,,,,,,,,,,,Siti Hardijanti Hastuti,,,,,,,,,,,,,,,,,,,,,,,,,,,Sigit Harjojudanto (adik)Bambang Trihatmodjo (adik)Siti Hediati Hariyadi (adik)Hutomo Mandala Putra (adik)Siti Hutami Endang Adiningsih (adik),,,,,,,,,,,,,,,,,,,,,,,,,,,,,,,,,,,,,,,,,,,,,,,,,,,,,,,,,,,,,,,,,,,,,,,,,,,,,,,,,,,,,,,,,,,,,,,,,,,,,,,Soeharto (bapak)Siti Hartinah (ibu),,,,,,,,,,,,,,,,,,,Siti Hardijanti Rukmana
Soegih Arto,Letjen TNI (Purn.),,sugiharto.jpg,,,,1966,1973,,Agustinus Sutardhio,Ali Said,,,,,,,,,,,,,,,,,,,,,,,,,,,,,,,,,,,,,,,,,,"Yogyakarta, Hindia Belanda",,"Jakarta, Indonesia",,,,,"Jaksa, TNI",Islam,,,,25px TNI Angkatan Darat,1945 - 1979,25px Letnan Jenderal TNI,,Infanteri,Revolusi Nasional Indonesia,,,,,,,,,,,,,,,,,,,,,,,,,,,,,,,,,,,,,,,,,,,,,,,,,,,,,,,,,,,,,,,,,,,,,,,,,,,,,,,,,,,,,,,,,,,,,,,,,,,,,,,,,,,,,,,,,,,,,,,,,,,"Taman Makam Pahlawan Nasional Utama Kalibata, Jakarta Selatan, DKI Jakarta",,,,,,,,,,,,,,,,,,,,,,,,,,,,,,,,,,,,,,,,,,,,,,,,,,,,,,,,,,Hogere Kriegjschool (1952),,,,,,,,,,,,,,,,,,,,Soegih Arto
Yoga Sugama,,Yoga Sugama,Yoga Soegomo.jpg,Jenderal (Purn) Yoga Sugama,Kepala Badan Intelijen NegaraKepala Badan Koordinasi Intelijen Negara,Ke-4,Januari 1974,Juni 1989,Soeharto,Sutopo Juwono,Sudibyo,Daftar Duta Besar Indonesia untuk Perserikatan Bangsa-BangsaDuta Besar Indonesia untuk Perserikatan Bangsa-Bangsa,7,1971,1974,Soeharto,Roeslan Abdulgani,Khaidir Anwar Sani,Daftar Kepala Badan Intelijen NegaraKepala Komando Intelijen Negara,Ke-4,22 Agustus 1966,22 Mei 1967,SoekarnoSoeharto,Soeharto,Soedirgo,,,,,,,,,,,,,,,,,,,,,,,,,,,,"Tegal, Jawa Tengah, Hindia Belanda",,"Jakarta, Indonesia",,,,,,,,,Indonesia,25px TNI Angkatan Darat,,25px|  Jenderal TNI,,,,,,,,,,,,,,,Adam MalikUmar WirahadikusumahSudharmono,,,,,,,,,,,,,,,,,,,,,,,,,,,,,,,,,,,,,,,,,,,,,,,,,,,,,,,,,,,,,,,,,,,,,,,,1980,,,SudomoL.B. Moerdani,,,,,,,,,,,,,,,,Kepala Staf Komando Keamanan dan Ketertiban,,,,Panglima Kopkamtib,,,,,,,,,,,,,14527,,,,,,,,,,,,,,,,,,,,,,Soeharto,,,,,,,200px,,,,,,,,,,,,,,,,,,,,,,,,,,,,,,,,,,,,,,,,,,,,,,,,,,,1989,Yoga Sugama
Arie Jeffry Kumaat,Letnan Jenderal TNI (Purn),,File:Letnan Jenderal Arie Jeffry Kumaat.jpg,,Kepala Badan Koordinasi Intelijen Negara Ke-10,,1999,2001,Abdurrahman Wahid,Z.A. Maulani,A.M. Hendropriyono,,,,,,,,,,,,,,,,,,,,,,,,,,,,,,,,,,,,,,,,,,"Lansot, Tareran, Minahasa Selatan, Sulawesi Utara",,Jakarta,,,"Ny. Dr. Maria Josephine Kumaat-Mantik, M.Hum",Henrie August Liddell Kumaat,,,Sign Letjen TNI (Purn) Arie J. Kumaat.png,,,25px TNI Angkatan Darat,1966—1999,25px Letnan Jenderal TNI,,Infanteri,,,Letjen TNI G.H. Mantik (Ayah Mertua),,,,,,,,,,,,,,,,,,,,,,,,,,,,,,,,,,,,,,,,,,,,,,,,,,,,,,,,,,,,,,,,,,,,,,,,,,,,,,,,,,,,,,,,,,,,,,,,,,,,,,,,,,,,,,,,,,,,,,20722,,,,,,,,Tentara,,,,,,,,,,,,,,,,,,,,,,,,,,,,Adhi Makayasa (1966),,,,,,,,,,,,,,,,,,,,,,,,,,,,,,,,,,,,,,,,,,,,,Arie Jeffry Kumaat
Slamet Bratanata,,,Menteri Pertambangan Bratanata.jpg,,Menteri Pertambangan Indonesia,ke-4,25 Juli 1966,17 Oktober 1967,Soekarno,Ibnu Sutowo,Sumantri Brodjonegoro,,,,,,,,,,,,,,,,,,,,,,,,,,,,,,,,,,,,,,,,,,Surakarta,,"Jakarta, Indonesia",,,,,,,,,,,,,,,,,,,,,,,,,,,,,,,,,,,,,,,,,,,,,,,,,,,,,,,,,,,,,,,,,,,,,,,,,,,,,,,,,,,,,,,,,,,,,,,,,,,,,,,,,,,,,,,,,,,,,,,,,,,,,,,,,,,,,,,,,,,,,,,,,,,,,,,,,,,,,,,,,,,,130px,,,,,,,,,,,,,,,,,,,,,,,,,,,,,,,,,,,,,,,,,,,,,,,,,,,,Slamet Bratanata
Ali Wardhana,Prof. Dr.,Ali Wardhana,Ali wardhana.jpg,,"Menteri Koordinator Bidang Ekonomi, Keuangan, Industri dan Pengawasan Pembangunan Republik IndonesiaMenteri Koordinator Bidang Ekonomi, Keuangan, Industri dan Pengawasan Pembangunan",ke-3,19 Maret 1983,23 Maret 1988,Soeharto,Widjojo Nitisastro,Radius Prawiro,Menteri Keuangan Indonesia,ke-15,6 Juni 1968,19 Maret 1983,Soeharto,Frans Seda,Radius Prawiro,,,,,,,,,,,,,,,,,,,,,,,,,,,,,,,,,,,"Surakarta, Jawa Tengah, Hindia Belanda",,"Jakarta, Indonesia",,Golongan Karya,Rendasih binti Sulaeman Sukantabrata,4,,Islam,,,,,,,,,,,,,,,,,,,,,,,,,,,,,,,,,,,,,,,,,,,,"Karet Kuningan, Jakarta Selatan",,,,,,,,,,,,,,,,,,,,,,,,,,,,,,,,,,,,,,,,,,,,"Ali Sastroamidjojo (paman)
Robertus Sanyoto (adek keponakan)",,,,,,,,,,,,,,,,,,,,,,,,,,,,,,,,,,,,,,,,,,,,,,,,,Ekonom  Penasehat Perekonomian,,,,,,,,,,,,,,,,,,,,,,,,,,,,,,,,,,,,,,,,,,,,,,,,,,,,,,,,,,,,,,,,,,,,,,,,,Ali Wardhana
Soemitro Djojohadikoesoemo,Tan Sri,,"Sumitro Djojohadikusumo, Pekan Buku Indonesia 1954, p240.jpg",Sumitro pada 1954,Menteri Negara Riset Indonesia,ke-3,28 Maret 1973,28 Maret 1978,Soeharto,Suhadi Reksowardojo (1966),B. J. Habibie,,,3 April 1952,30 Juli 1953,Soekarno,Jusuf Wibisono,Ong Eng Die,Menteri Perdagangan Indonesia,ke-7,6 Juni 1968,28 Maret 1973,Soeharto,M. Jusuf,Radius Prawiro,6 September 1950,27 April 1951,Soekarno,Tandiono Manu,Sujono Hadinoto,,,,,,,,,,,,,,,,,,,,,,,"Kebumen, Hindia Belanda",,"Jakarta, Indonesia",,Partai Sosialis Indonesia (1955–1960),Dora Marie Sigar,Biantiningsih Miderawati DjiwandonoMarjani Ekowati LemaistrePrabowo Subianto  Hashim Djojohadikusumo,,,Signature of Sumitro Djojohadikusumo.png,,,,,,,,,,Soeharto(besan)Titiek Soeharto(menantu),,,,,,,,,,,,,,,,,,,,,,,,,,,Mohammad Natsir,,,,,,,,,,,,,,,,Jusuf Wibisono,,,,,,,,,,,,,,,,,,,,,,Wilopo,,,,,,,,,,,,,,,,,12 Agustus 1955,,,,,,,,,,,,,,,,,,,Menteri Keuangan Indonesia,,,,,,,,,,,,,,,ke-8,,,,,,,,,,"Ekonom, politikus",,,,,,,,,,,,,,Soekarno,,,Burhanuddin Harahap,,,,,,,,,,,,Tanda tangan Sumitro Djojohadikusumo,,,,,,,,,,,,,,,,160px,,,,,,,,Universitas SorbonneSekolah Tinggi Ekonomi Belanda,Margono Djojohadikoesoemo(ayah)Siti Katoemi Wirodihardjo(ibu),,,,,,Ong Eng Die,,,,,,,,,,,,24 Maret 1956,Soemitro Djojohadikoesoemo
Harsono Tjokroaminoto,,,"Harsono Tjokroaminoto, Pekan Buku Indonesia 1954, p247.jpg",,,,Maret 1972,Maret 1975,Soeharto,Mappa Oudang,Tjokorde Ngurah Will Sukawati,Wakil Perdana Menteri Indonesia,ke-9,12 Agustus 1955,24 Maret 1956,Soekarno,Zainul ArifinWongsonegoro,Mohamad Roem Idham Chalid,,,,,,,,,,,,,,,,,,,,,,,,,,,,,,,,,,,"Madiun, Hindia Belanda",,"Jakarta, Indonesia",,PSII,,,,,,,,,,,,,,,,,,,,,,,,,,,,,,Burhanuddin Harahap,,,Indonesia,,,,,,,,,,,,,,,,,,H.O.S. Tjokroaminoto,,,,,,,Emil Salim,,,,,,,,,,,,,,,Djanoe Ismadi,,,,,,,,,,,,,Swiss,,,,,,M.S. Hidayat (menantu),,,,,10 Juni 1968,,,,,,,,,,,,,,,,,,,Menteri Negara Bidang Penyempurnaan dan Pembersihan Aparatur Negara Indonesia,,,,,,,,,,,,,,,ke-1,,,,,,,,,,,,,,,,,,,,,,,,Soeharto,,,,,,,,,,,,,,,,,,,,,,,,,,,,,,,,,,,,,,,,,,,,,,Tidak Ada,,,,,,,,,,,,11 September 1971,Harsono Tjokroaminoto
Rachmat Saleh,,,Rachmat Saleh.jpg,Rachmat pada 1986,Menteri Perdagangan Indonesia,ke-21,19 Maret 1983,21 Maret 1988,Soeharto,Radius Prawiro,Arifin Siregar,,,,,,,,,,,,,,,,,,,,,,,,,,,,,,,,,,,,,,,,,,"Surabaya, Jawa Timur, Hindia Belanda",,"Jakarta, Indonesia",Indonesia,,,,,Islam,Sign Rachmat Saleh (Gubernur BI).png,,,,,,,,,,,,,,,,,,,,,,,,,,,,,,,,,,,,,,,,,,,,,,,,,,,,,Arifin Siregar,,,,,,,,,,,,,,,,,,,,,,,,,,,,,,,,,,,,,,,5 April 1973,,,,,,,,,,,,,,,,,,,Gubernur Bank Indonesia,,,,,,,,,,,,,,,ke-7,,,,,,,,,,,,,,,,,,,,,,,,Soeharto,,,,,,,,,,,,,,,,,,,,,,,,,,,,,,,,,,,,,,,Universitas Indonesia,,,,,,,Radius Prawiro,,,,,,,,,,,,16 Maret 1983,Rachmat Saleh
Suyono Sosrodarsono,,,MenPU Suyono Sosrodarsono.jpg,,Menteri Pekerjaan Umum Indonesia,ke-18,19 Maret 1983,21 Maret 1988,Soeharto,Purnomosidi Hadjisarosa,Radinal Mochtar,,,,,,,,,,,,,,,,,,,,,,,,,,,,,,,,,,,,,,,,,,"Madiun, Jawa Timur, Hindia Belanda",,"Jakarta, Indonesia",Indonesia,,dr. Astuti Suyono Sosrodarsono,,,Islam,,,,,,,,,,,,,,,,,,,,,,,,,,,,,,,,,,,,,,,,,,,,,,,,,,,,,,,,,,,,,,,,,,,,,,,,,,,,,,,,,,,,,,,,,,,,,,,,,,,,,,,,,,,,,,,,,,,,,,,,,,,,,,,,,,,,,,,,,,,,,,,,,,,,,,,,,,,,,,,,,,,,,,,,,,,,,,,,,,,,,,,,,,,,,,Institut Teknologi Bandung,,,,,,,,,,,,,,,,,,,,Suyono Sosrodarsono
Amir Machmud,,Amir Machmud,Amirmachmud.jpg,Amir Machmud sebagai Pangdam V/Jayakarta,Ketua Majelis Permusyawaratan Rakyat Republik Indonesia,ke-6,1 Oktober 1982,30 September 1987,,Daryatmo,Kharis Suhud,Menteri Dalam Negeri Indonesia,ke-17,9 Januari 1969,1 Oktober 1982,Soeharto,Basuki Rachmat,Soepardjo Rustam,Komando Daerah Militer X/Lambung MangkuratPangdam X/Lambung Mangkurat,ke-4,28 November 1962,15 November 1965,,Kolonel Inf M. Jusi,Kolonel Inf R. Sutopo Juwono,,,,,,,,,,,,,,,,,,,,,,,,,,,,"Cimahi, Hindia Belanda",,"Cimahi, Jawa Barat, Indonesia",,,,,,,,,,25px TNI Angkatan Darat,1943—1978,25px Jenderal TNI,,Infanteri,Revolusi Nasional Indonesia,,Kaharudin Datuk Rangkayo Basa (adik ipar),,,,,,,,,,,,,,,,,,,,,,,,,,,,,,,,,,,,,,,,,,,Kharis Suhud,,,,,,,,,,,,,,,,,,,,,,,,,,,,,,,,,,,,,,,1 Oktober 1982,,,,,,,,,,,,,,,,,,,Ketua Dewan Perwakilan Rakyat Republik Indonesia,,,,,,,,,,,,,,,ke-9,,11646,,,,,,,,TNI,,,,,,,,,,,,,,Soeharto,,,,,,,,,,,,,,,,,,,,,,,,,,,,,,,,,,,,,,,Akademi Militer,,,,,,,Daryatmo,,,,,,,,,,,,1 Oktober 1987,Amir Machmud
Sutanto Wiryoprasonto,,Sutanto Wiryoprasonto,10 Mayjen TNI Sutanto Wirjoprasonto.jpg,,Wakil Ketua Badan Pertimbangan Pendidikan Nasional,,1989,1993,,,,Sekretaris Jenderal Departemen Pendidikan dan Kebudayaan,,28 April 1980,12 Januari 1987,,Teuku Umar Ali,Bambang Triantoro,,,,,,,,,,,,,,,,,,,,,,,,,,,,,,,,,,,"Surakarta, Jawa Tengah, Hindia Belanda",,,,,,,,,,,,25px TNI Angkatan Darat,1944—1979,25px Letnan Jenderal TNI,,Infanteri,,,,,,,,,,,,,,,,,,,,,,,,,,,,,,,,,,,,,,,,,,,,,,,,,,,,,,,,,,,,,,,,,,,,,,,,,,,,,,,,,,,,,6 Desember 1989,,,,,,,,,,,,,,,,,,,Anggota Badan Pertimbangan Pendidikan Nasional,,,,,,,,,,,,,,,,,10964,,,,,,,,,,,,,,,,,,,,,,,,,,,,,,,,,,,,,,,,,,,,,,,,,,,,,,,,,,,,,,,,,,,,,,,,,,,,,,,,1998,Sutanto Wiryoprasonto
Kemal Idris,Letnan Jenderal TNI (Purn.),Kemal Idris,,,,,,,,,,,,,,,,,,,,,,,,,,,,,,,,,,,,,,,,,,,,,,,,,,,"Singaraja, Bali, Hindia Belanda",,Jakarta,,,Ny. Herwinoer Bandriani Singgih,1. Ferry Idris2. Ade Idris3. Indra Idris,,,,,,25px TNI Angkatan Darat,1942-1972,25px Letnan Jenderal TNI,,Infanteri,,,,,,,,,,,,,,,,,,,,,,,,,,,,,,,,,,,,,,,,,,,,,,,,,,,,,,,,,,,,,,,,,,,,,,,,,,,,,,,,,,,,,,,,,,,,,,,,,,,,,,,,,,,,,,,,,,,,,,,,,13094,,,,,,,,,,,,,,,,,,,,,,,,,,,,,,,,,,,,,,,,,,,,,,,,,,,,,,,,,,,,,,,,,,,,,,,,,,,,,,,,,Kemal Idris
J. B. Sumarlin,,J. B. Sumarlin,Jb_sumarlin.jpg,,Menteri Keuangan Indonesia,ke-17,21 Maret 1988,17 Maret 1993,Soeharto,Radius Prawiro,Marie Muhammad,,,18 Desember 1973,22 Januari 1974,Soeharto,Sumantri Brodjonegoro,Syarief Thayeb,Kepala Badan Perencanaan Pembangunan Nasional,ke-3,19 Maret 1983,21 Maret 1988,Soeharto,Widjojo Nitisastro,Saleh Afif,28 Maret 1973,19 Maret 1983,Soeharto,Emil Salim,Saleh Afif,Kepala Badan Pengusahaan Batam,ke-2,1976,1978,Soeharto,Ibnu Sutowo,Bacharuddin Jusuf Habibie,,,,,,,,,,,,,,,7 Desember 1932,"Nglegok, Blitar, Jawa Timur, Hindia Belanda",,"Jakarta, Indonesia",,,Theresia Yostiana Soedarmi,5,,,,,,,,,,,,,,,,,,,,,,,,,,,,,,,,,,,,,,,,,,,,,,,,Menteri Negara Penertiban Aparatur Negara Indonesia,,,,,,,,Fuad Hassan,,,,,,,,,,,,,,,,,,,,,,,,,,,,,,,,,,,,,,,3 Juni 1985,,,,,,,,,,,,,,,ke-3,,,,Menteri Pendidikan dan Kebudayaan<small>(ad-interim),,,,,,,,,,,,,,,,,,,,,,,,,Ekonom,,,,,,,,,,,,,,Soeharto,,,,,,,,,,,,,,,,,,,,,,,,,,,,,,,,,,,,,,,Universitas Indonesia,,,,,,,Nugroho Notosusanto,,,,,,,,,,,,29 Juli 1985,J. B. Sumarlin
Sunawar Sukowati,,Sunawar Sukowati,Sunawar Sukowati.jpg,,Menteri Negara Bidang Pengawasan Proyek-proyek Pemerintah Indonesia,ke-1,10 Juni 1968,9 September 1971,Soeharto,,Widjojo Nitisastro,Ketua Umum Partai Demokrasi Indonesia,,16 Oktober 1980,12 Januari 1986,,Sanusi Hardjadinata,Soerjadi,,,,,,,,,,,,,,,,,,,,,,,,,,,,,,,,,,,"Solo, Jawa Tengah, Hindia Belanda",,"Bogor, Jawa Barat, Indonesia",,Partai Demokrasi Indonesia  Partai Nasional Indonesia,,Edwin Sunawar Sukowati,,,,,,,,,,,,,,,,,,,,,,,,,,,,,,,,,,,,,,,,,,,,,,,,,,,,,,,,Surono Reksodimedjo,,,,,,,,,,,,,,,,,,,,,,,,,,,,,,,,,,,,,,,28 Maret 1973,,,,,,,,,,,,,,,,,,,Menteri Negara Kesejahteraan Rakyat Indonesia,,,,,,,,,,,,,,,ke-5,,,,,,,,,,Pengacara,,,,,,,,,,,,,,Soeharto,,,,,,,,,,,,,,,,,,,,,,,,,,,,,,,,,,,,,,,Universitas Gadjah MadaUniversitas Padjadjaran,,,,,,,Idham Chalid,,,,,,,,,,,,29 Maret 1978,Sunawar Sukowati
Basuki Rahmat,,,"Basuki Rahmat, Departemen Dalam Negeri dari Masa ke Masa, p121.jpg",Basuki Rahmat sebagai Mendagri,Daftar Menteri Dalam Negeri IndonesiaMenteri Dalam Negeri Indonesia,ke-16,18 Maret 1966,9 Januari 1969<small>(ad-interim sampai 28 Maret 1966),,Soemarno Sosroatmodjo,Amir Machmud,Daftar Menteri Veteran dan Demobilisasi IndonesiaMenteri Urusan Veteran dan Demobilisasi,ke-6,24 Februari 1966,28 Maret 1966,Soekarno,M. Sarbini,M. Sarbini,Penjabat Gubernur DKI Jakarta,,18 Maret 1966,28 April 1966,Soekarno,Soemarno Sosroatmodjo,Ali Sadikin,,,,,,,,,,,,,,,,,,,,,,,,,,,,"Senori, Tuban, Hindia Belanda",,"Jakarta, Indonesia",Indonesia,,,,Tentara,Islam,,,,,1943—1967,25px Mayor Jenderal TNI,,Infanteri,Revolusi Nasional Indonesia,,,,,,,,,,,,,,,,,,,,,,,,,,,,,,,,,,,,,,,,,,,,,,,,,,,,,,,,,,,,,,,,,,,,,,,,,,,,,,,,,,,,,,,,,,,,,,,,,,,,,,,,,,,,,,,,,,,,,,,,,,,,,,,,,,,,,,,,,,,,,,,,,,,,,,,,,,,,,,,,,,,,,,,,,,,,,,,,,,,,,,,,,,,,,,,,,,,,,,,,,Basuki Rahmat
Amir Murtono,,Amir Murtono,"Amir Murtono, Memperkenalkan Anggota-Anggota DPR Hasil Pemilu 1982, p148.jpg",,Ketua Umum Partai Golkar,ke-3,1973,1983,,Suprapto Sukowati,Sudharmono,,,,,,,,,,,,,,,,,,,,,,,,,,,,,,,,,,,,,,,,,7 Juli 1924,"Kertosono, Nganjuk, Jawa Timur",2021 (umur 96–97),,Indonesia,,Naniek Kusmani,,,,,,Indonesia,25px TNI Angkatan Darat,,25px Mayor Jenderal TNI,,Infanteri,,,,,,,,,,,,,,,,,,,,,,,,,,,,,,,,,,,,,,,,,,,,,,,,,,,,,,,,,,,,,,,,,,,,,,,,,,,,,,,,,,,,,,,,,,,,,,,,,,,,,,,,,,,,,,,,,,,,,,,,,,,,,,,,,,,,,,,,,,,,,,,,,,,,,,,,,,,,,,,,,,,,,,,,,,,,,,,,,,,,,,,,,,,,,,,,,,,,,,,,,,Amir Murtono
Hario Jonosewojo,,K.R.M. Hario Jonosewojo,,,Panglima Divisi VI/Narotama TRI,,,,,,,,,,,,,,,,,,,,,,,,,,,,,,,,,,,,,,,,,,,,,,,,"Surabaya, Jawa Timur",,Jakarta,,,Ny. Roro Soerjasah Gondokoesoemo,7,Tentara,Islam,,,,25px TNI Angkatan Darat,1945-1970,25px Mayor Jenderal TNI,,,,,K.G.P.A.A. Mangkunegara VI (Kakek),,,,,,,,,,,,,,,,,,,,,,,,,,,,,,,,,,,,,,,,,,,,,,,,,,,,,,,,,,,,,,,,,,,,,,,,,,,,,,,,,,,,,,,,,,,,,,,,,,,,,,,,,,,,,,,,,,,,,,,,,,,,,,,,,,,,,,,,,,,,,,,,,,,,,,,,,,,,,,,,,,,,,,,,,,,,,,,,,,,,Kanjeng Pangeran Adipati Soejono Handajaningrat,,,,,,,,,,,,,,,,,,,Hario Jonosewojo
Ali Moertopo,,Ali Moertopo,"Ali Moertopo closing Indonesian Film Festival, Festival Film Indonesia (1982), 1983, p67 (cropped).jpg",Ali Moertopo di acara penutupan FFI 1982,,,,,,,,Wakil Ketua Dewan Pertimbangan Agung,,1983,15 Mei 1984,,,Makmun Murod,,,,,,,,,,,,,,,,,,,,,,,,,,,,,,,,,,,"Cepu, Blora, Jawa Tengah, Hindia Belanda",,"Jakarta, Indonesia",,,Wastoeti,Harris Ali Moerfi (l.1959-2010)  Lucky Ali Moerfiqin (l.1963),,Islam,Sign Ali Moertopo.png,,Indonesia,25px TNI Angkatan Darat,1945—1978,25px|  Letnan Jenderal TNI,,Infanteri,,,,,,,,,,,,,,,,,,,,,,,,,,,,,,,,,,,,"Jalan Raden Saleh, Jakarta Pusat.",,,,,,,,,,Harmoko,,,,,,,,,,,,,,,,,,,,,,,,,,,,,,,,,,,,,,,29 Maret 1978,,,,,,,,,,,,,,,,,,,Menteri Penerangan Indonesia,,,,,,,,,,"Jailani Naro, Sapardjo, Sunawar Sukowati",,,,,Ke-21,,,,,,,,,,,,,,,,,,,,,,,,Soeharto,,,,,,,,,,,,,,,,,,,,,,,,,,,,,,,,,,,,,,,"Pendidikan militer tk. Bintara di Gombong, Kebumen",,,,,,,Mashuri Saleh,,,,,,,,,,,,19 Maret 1983,Ali Moertopo
Widjojo Nitisastro,Prof. Dr.,,Widjojo Nitisastro (1977).jpg,,"Menteri Koordinator Bidang Ekonomi, Keuangan, dan Industri Indonesia",ke-2,29 Maret 1973,19 Maret 1983,Soeharto,Hamengkubuwono IX,Ali Wardhana,Menteri Negara Perencanaan Pembangunan Nasional Indonesia,ke-4,9 September 1971,28 Maret 1973,Soeharto,Ruslan Abdulgani,J. B. Sumarlin,,,,,,,,,,,,,,,,,,,,,,,,,,,,,,,,,,,"Keresidenan Malang, Hindia Belanda",,"Jakarta, Indonesia",,Golongan Karya,Siti Sudarsih,2,,Islam,,,,,,,,,,,,,,,,,,,,,,,,,,,,,,,,,,,,,,,,,,,,,,,,,,,,,,J. B. Sumarlin,,,,,,,,,,,,,,,,,,,,,,,,,,,,,,,,,,,,,,,8 Juni 1967,,,,,,,,,,,,,,,,,,,Kepala Badan Perencanaan Pembangunan Nasional,,,,,,,,,,,,,,,ke-8,,,,,,,,,,,,,,,,,,,,,,,,Soeharto,,,,,,,,,,,,,,,,,,,,,,,,,,,,,,,,,,,,,,,Universitas IndonesiaUniversity of California,,,,,,,Ruslan Abdulgani,,,,,,,,,,,,19 Maret 1983,Widjojo Nitisastro
Jusuf Wanandi,,Jusuf Wanandi,,,,,,,,,,,,,,,,,,,,,,,,,,,,,,,,,,,,,,,,,,,,,,,,,,,"Sawahlunto, Sumatera Barat, Hindia Belanda",,,,,,,,Katolik,,,,,,,,,,,Sofjan Wanandi (adik),,,,,,,,,,,,,,,,,,,,,,,,,,,,,,,,,,,,,,,,,,,,,,,,,,,,,,,,,,,,,,,,,,,,,,,,,,,,,,,,,,,,,,,,,,,,,,,,,,,,,,,,,,,,,,,,,,,,,,,,,,,,,,,,,,,,,,,,,,,,,,,,,,,,,,,,,,,,,,,,,,,,,,,,,,,,,,,,,,,,Liem Gim To & Tjoa Gim Jong Nio,,,,,,,,,,,,,,,,,,,Jusuf Wanandi
Sapardjo,Mayjen TNI,,,,Menteri Sosial Indonesia,ke-19,31 Maret 1978,19 Maret 1983,Soeharto,Mohammad Syafa'at Mintaredja,Nani Soedarsono,,,,,,,,,,,,,,,,,,,,,,,,,,,,,,,,,,,,,,,,,,"Yogyakarta, DI Yogyakarta, Hindia Belanda",,"Yogyakarta, Indonesia",,Golongan Karya,Endang Suparti,Bambang Purwanto,,,,,,,,,,,,,,,,,,,,,,,,,,,,,,,,,,,,,,,,,,,,,,,,,,,,,,,,,,,,,,,,,,,,,,,,,,,,,,,,,,,,,,,,,,,,,,,,,,,,,,,,,,,,,,,,,,,,,,,,,,,,,,,,,,,,,,,,,,,,,,,,,,,,,,,,,,,,,,,,,,,,,,,,,,,,,,,,,,,,,,,,,,,,,,,,,,,,,,,,,,,,,,,,,,,,Sapardjo
