Ali Said,Yang Mulia,Ali Said,Ali Said.png,Potret Ali Said sebagai Ketua Mahkamah Agung,Ketua Mahkamah Agung Republik Indonesia,ke-7,14 April 1984,1 Juli 1992,,Mudjono,Purwoto Gandasubrata,Jaksa Agung Republik Indonesia,ke-9,4 April 1973,18 Februari 1981,Soeharto,Sugih Arto,Ismail Saleh,Komisi Nasional Hak Asasi ManusiaKetua Komisi Nasional Hak Asasi Manusia,ke-1,1993,1996,,pejabat pertama,Djoko Soegianto,,,,,,,,,,,,,,,,,,,,,,,,,,,,"Magelang, Hindia Belanda",,"Jakarta, Indonesia",Indonesia,,,,,,,,,25px TNI Angkatan Darat,,25px Letnan Jenderal TNI,,Korps Hukum,,,,,,,,,,,,,,,,,,,,,,,,,,,,,,,,,,,,,,,,,,,,,,Ismail Saleh,,,,,,,,,,,,,,,,,,,,,,,,,,,Soeharto,,,,,,,,,,,,9 Februari 1981,,,,,,,,,,,,,,,,,,,Menteri Kehakiman Indonesia,,,,,,,,,,,,,,,ke-17,,,,,,,,,,"hakim, perwira militer",,,,,,,,,,,,,,Soeharto,,,,,,,,,,,,,,,,,,,,,,,,,,,,,,,,,,,,,,,PTHM,,,,,,,Mudjono,,,,,,,,,,,,30 Mei 1984,Ali Said
Mohammad Syafa'at Mintaredja,,Mohammad Syafaat Mintaredja,Mohammad Syafaat Mintaredja.jpg,Mohammad Syafaat Mintaredja,Menteri Sosial Indonesia,ke-18,9 September 1971,29 Maret 1978,Soeharto,Albert Mangaratua Tambunan,Supardjo,,,,,,,,Ketua Umum Partai Persatuan Pembangunan,ke-1,1973,1978,Soeharto,,Djaelani Naro,,,,,,,,,,,,,,,,,,,,,,,,,,,,"Bogor, Jawa Barat, Indonesia",,"Jakarta, Indonesia",Indonesia,,Siti Romlah,Evac S Mintaredja,,Islam,,,,,,,,,,,,,,,,,,,,,,,,,,,,,,,,,,,,,,,,,,,,,,,,,,,,,,Jabatan Baru,,,,,,,,,,,,,,,,,,,,,,,,,,,,,,,,,,,,,,,6 Juni 1968,,,,,,,,,,,,,,,,,,,"Menteri Negara Penyelenggaraan Hubungan antara Pemerintah dengan MPR, DPR-GR, dan DPA",,,,,,,,,,,,,,,,,,,,,,,,,,,,,,,,,,,,,,,Soeharto,,,,,,,,,,,,,,,,,,,,,,,,,,,,,,,,,,,,,,,,,,,,,,Tidak Ada,,,,,,,,,,,,9 September 1971,Mohammad Syafa'at Mintaredja
Soesilo Soedarman,Jenderal (HOR) TNI (Purn.),Soesilo Soedarman,Sixth Development Cabinet Poster (Soesilo Soedarman).jpg,,"Menteri Koordinator Bidang Politik, Hukum, dan Keamanan Republik IndonesiaMenteri Koordinator Bidang Politik dan Keamanan Republik Indonesia",ke-4,17 Maret 1993,18 Desember 1997,Soeharto,Sudomo,Feisal Tanjung,"Menteri Pariwisata, Pos, dan Telekomunikasi Indonesia",ke-3,21 Maret 1988,17 Maret 1993,Soeharto,Achmad Tahir,Joop Ave,Duta Besar Indonesia untuk Amerika Serikat,ke-11,1986,1988,Soeharto,Hasnan A. Habib,Abdul Rahman Ramly,,,,,,,,,,,,,,,,,,,,,,,,,,,,"Kroya, Cilacap, Jawa Tengah, Hindia Belanda",,"Jakarta, Indonesia",Indonesia,Partai Golongan Karya,Ny. Widaningsri,Indroyono Soesilo,Militer,Islam,,,Indonesia,25px TNI Angkatan Darat,,25px Jenderal TNI,,Kavaleri,,,Mayjen TNI (Purn.) Muhammad Mangundiprojo (Ayah Mertua)Letjen TNI (Purn.) Himawan Soetanto (Kakak Ipar)Laksma TNI (Purn.) Wartono Soedarman (Adik Kandung),,,,,,,,,,,,,,,,,,,,,,,,,,,,,,,,,,,,,,,,,,,,,,,,,,,,,,,,,,,,,,,,,,,,,,,,,,,,,,,,,,,,,,,,,,,,Ikhtiar P. Pratama,,,,,,,,,,,Pembengkakan jantung,,,,,,,,,,,,,,,,,,,,,,,,,,,,,,,,,,,,,,,,,,,,,,,,,,,,,,,,,,,,,,,,,,,,,,,,,,,,Militaire Academie (MA) Jogya Angkatan I (1948),,,,,,,,,,,,,,,,,,,,Soesilo Soedarman
Hamengkubuwana IX,,Hamengkubuwana IX,Hamengkubawono IX Official Portrait.jpg,"Potret resmi sebagai Wakil Presiden, 1973",Sultan Yogyakarta,ke-9,18 Maret 1940,2 Oktober 1988,,Hamengkubuwana VIII,Hamengkubuwana X,Wakil Presiden Indonesia,ke-2,23 Maret 1973,23 Maret 1978,Soeharto,Mohammad Hatta,Adam Malik,"Daftar Menteri Koordinator Bidang Perekonomian IndonesiaMenteri Koordinator Ekonomi, Keuangan, dan Industri Indonesia",ke-1,25 Juli 1966,29 Maret 1973,Soeharto,"Tidak ada, jabatan baru",Widjojo Nitisastro,6 September 1950,27 April 1951,Soekarno,Abdul Hakim,Suwiryo,,,18 Maret 1966,27 Maret 1966,,Soebandrio(Wakil Perdana Menteri I),,31 Maret 1966,25 Juli 1966,,,Jabatan dihapuskan,Menteri Negara Indonesia,,,,,,Menteri Negara,,,,"Ngasem, Kesultanan Ngayogyakarta Hadiningrat, Keresidenan Yogyakarta, Hindia Belanda",,"Washington, D.C., Amerika Serikat",,,,,,,Sign HBIX.png,,,25px|ki TNI Angkatan Darat,1945–1953,25px|  Jenderal TNI (Tit.),,,,,,,,,,,,ke-1,,,,,,,,,,,,,,Surono Reksodimedjo,,,,,,Mohammad Natsir,,,,,,,,Daftar Wakil Perdana Menteri IndonesiaWakil Perdana Menteri Indonesia,,1967,,,,,,,2 Oktober 1988,,Masa jabatan (ad interim),,,,Gusti Raden Mas Dorodjatun,,Mulai bertakhta,,,,,,,Menteri/Ketua Badan Pemeriksa Keuangan,,,,,,,,,,Paku Alam VIII,,,,,M. Sarbini,,,,,,,,,,Komite Olahraga Nasional Indonesia,,"Johannes Leimena, Adam Malik, Soeharto, Idham Chalid",Paku Alam VIII,,1986,,,,"Johannes Leimena, Adam Malik (a.i.), Idham Chalid, Roeslan Abdulgani",Ingkang Sinuwun Sri Sultan,,,ke-5,,,4 Maret 1950,,,,,,27 November 1974,,,14 Agustus 1961,,,Soekarno,,"Tidak ada, jabatan baru",,,Menteri Pariwisata,,,,,,,,,,,,,,,,,,,,,,,,,,,,,,,,,,,,"Tidak ada, jabatan baru",,,,,,,,,Ketua Kwartir Nasional Gerakan Pramuka,,,,,,,,,,,,,,,,,,,,ke-1,Menteri Pertahanan,,,,,,Gubernur Daerah Istimewa Yogyakarta,,,,,,ke-1,,,,Hamengkubuwana IX
Soerjadi (hakim),Yang Mulia Mr.,Soerjadi,Soerjadi.jpg,Potret Soerjadi sebagai Ketua Mahkamah Agung,Ketua Mahkamah Agung Republik Indonesia,ke-3,21 Juni 1966,Agustus 1968,,Wirjono Prodjodikoro,Soebekti,,,,,,,,,,,,,,,,,,,,,,,,,,,,,,,,,,,,,,,,,,,,,Indonesia,,,,,,,,,,,,,,,,,,,,,,,,,,,,,,,,,,,,,,,,,,,,,,,,,,,,,,,,,,,,,,,,,,,,,,,,,,,,,,,,,,,,,,Soekarno,,,,,,,,,,,,,,,,,,,,,,,,,,,,,,,,,,,,,,,,,,,,,,,,,,,,,,,,hakim,,,,,,,,,,,,,,,,,,,,,,,,,,,,,,,,,,,,,,,,,,,,,,,,,,,,,,,,,,,,,,,,,,,,,,,,,Soerjadi (hakim)
Subroto,,,Subroto.jpg,,Daftar Menteri Energi dan Sumber Daya Mineral Indonesia,ke-7,29 Maret 1978,21 Maret 1988,Soeharto,Mohammad Sadli,Ginandjar Kartasasmita,Daftar Menteri Ketenagakerjaan Indonesia,"Menteri Transmigrasi dan Koperasi (11 September 1971-28 Maret 1973); Menteri Tenaga Kerja, Transmigrasi, dan Koperasi (28 Maret 1973-29 Maret 1978).",11 September 1971,29 Maret 1978,Soeharto,M. Sarbini,Harun ZainRadius PrawiroBustanil Arifin,,,,,,,,,,,,,,,,,,,,,,,,,,,,,,,,,,,"Sewu, Jebres, Surakarta, Jawa Tengah, Hindia Belanda",,Jakarta,Indonesia,,Trisnawati,,,Islam,,,,,,,,,,,,,,,,,,,,,,,,,,,,,,,,,,,,,,,,,,,,,,,,,,"Menteri Tenaga Kerja, Transmigrasi, dan Koperasi Indonesia",,,,,,,,,,,,,,,,,,,,,,,,,,,,,,,,,,,,,,,,,,,,,,,,,,,,,,,,,,,,,,,,,,,,,,,,,,,,,,,,,,,,,,,Akademisi,,,,,,,,,,,,,,,,,,,,,,,,,,,,,,,,,,,,,,,Menteri Pertambangan dan Energi Indonesia,,,,,,,,,,,,,,Universitas Indonesia,,,,,,,,,,,,,,,,,,,,Subroto
Andi Muhammad Ghalib,,Andi Muhammad Ghalib,Andi Muhammad Ghalib.jpg,Potret resmi sebagai Kababinkum ABRI,Jaksa Agung Republik Indonesia,ke-15,1998,1999,Bacharuddin Jusuf Habibie,Soedjono C. Atmonegoro,Marzuki Darusman,Anggota Dewan Perwakilan Rakyat,,1 Oktober 2014,9 Mei 2016,,,Andi Djamaro Dulung,,,1 Oktober 2004,30 September 2009,,,,1998,1998,,Suhardi,Timur P. Manurung,Wakil Gubernur Sulawesi Selatan,ke-4,1992,1995,,Ambo Eteng Amin,Dharmadi Charsyah,,,,,,,,,,,,,,,,"Kaju, Tunreng Tellue, Sibulue, Bone, Sulawesi, Indonesia",,"Jakarta, Indonesia",,Partai Persatuan Pembangunan,Andi Murniati,,,Islam,,,,25px TNI Angkatan Darat,1969—1999,25px Letnan Jenderal TNI,,Korps Hukum (Chk),,,,,,,,,,,,,,,,Sulawesi Selatan I,,,,,,,,,,,,,,,,,,,,,,Kepala Badan Pembinaan Hukum Angkatan Bersenjata Republik Indonesia,,,,,,,,Rizali Wilmar Indrakesuma,,,,,,,,,,,,,,,,,,,150px,,,,,,,,,,,,,,,,,,,,2008,,,,,,,,,Sulawesi Selatan II,,,,,,,,,,Duta Besar Indonesia untuk India,,,,,,,,,,,,,,,ke-17,,,,,,,,,,,,,,,,,,,,,,,,Susilo Bambang Yudhoyono,,,,,,,,Zainal Basri Palaguna,,,,,,,,,,,,,,,,,,,,,,,,,,,,,,,,,,,,,,Donnilo Anwar,,,,,,,,,,,,2013,Andi Muhammad Ghalib
Widjojo Soejono,Jenderal TNI (Purn.),,250px,Jenderal TNI (Purn) Widjojo Soejono,Kepala Staf Komando Keamanan dan Ketertiban,,1980,1982,Soeharto,,,,,,,,,,,,,,,,,,,,,,,,,,,,,,,,,,,,,,,,,,,,"Tulungagung, Jawa Timur",,Jakarta Pusat,,,Ny. Siti Mastoechajah (Alm),1. Enny Lukitaning Diah2. Wedhia Purwaningsih3. Ariyati Sihwarini4. Hardini Surjaningsih5. Budhi Soejono,,Islam,,,,25px TNI Angkatan Darat,1945–1982,25px Jenderal TNI,,Infanteri (Kopassandha),,,"Martodidjojo (Ayah)Roesmirah (Ibu) Kolonel Dr. Soewondo (Kakak)
Widjojo Soeprapto (Kakak)",,,Panglima Kopkamtib,,,,,,,,,,,,,,,,,,,,,,,,,,,,,,,,,,,,,,,,Brigjen TNI Witarmin,,,,,,,,,,,,,,,,,,,,,,,,,,,,,,,,,,,,,,,1967,,,,,,,,,,,,,,,,,,,Komandan Jenderal Komando Pasukan Khusus,,,,,,,,,,,,,,,ke-6,,,,,,,,,,,,,,,,,,,,,,,,,,,,,,,Widjojo Soejono,,,Adam Malik,,,,,,,,,,,,,,,Komandan Pusat Pasukan Khusus Angkatan Darat,,,,,,,,,,,,,,Peta (1945),,,,,,,Brigjen TNI Sarwo Edhi Wibowo,,,,,,,,,,,Sudomo,1970,Widjojo Soejono
Cosmas Batubara,,,Cosmas Batubara - Fourth Development Cabinet.jpg,,Menteri Tenaga Kerja dan Transmigrasi Republik IndonesiaMenteri Tenaga Kerja Indonesia,ke-16,21 Maret 1988,17 Maret 1993,Soeharto,Sudomo,Abdul Latief,Menteri Negara Perumahan Rakyat Republik IndonesiaMenteri Negara Perumahan Rakyat Indonesia,ke-1,22 April 1978,21 Maret 1988,Soeharto,Tidak ada,Siswono Yudohusodo,,,,,,,,,,,,,,,,,,,,,,,,,,,,,,,,,,,"Purba Saribu, Haranggaol Horison, Simalungun, Sumatera Utara, Hindia Belanda",,Jakarta,Indonesia,Partai Golkar,R.A. Cypriana Hadiwijono,,Pengusaha,Katolik,,,,,,,,,,,,,,,,,,,,,,,,,,,,,,,,,,,,,,,,,,,,,,,,,,,,,,,,,,,,,,,,,,,,,,,,,,,,,,,,,,,,,,,,,,,,,,,,,,,,,,,,,,,,,,,,,,,,,,,,,,,,,,,,,,,,,,,,,Komisaris Agung Podomoro dan Agung Sedayu Group  Rektor Podomoro University  Ketua Umum Yayasan Unika Santo Thomas Sumatera Utara,,,,,,,,,,,,,,,,,,,,,,,,,,,,,,,,,,,,,,,,,,,,,,,,,,,,,Universitas Indonesia,,,,,,,,,,,,,,,,,,,,Cosmas Batubara
Endang Kusuma Inten Soeweno,,Endang Kusuma Inten Soeweno,Sixth Development Cabinet Poster (Endang Kusuma Inten Soeweno).jpg,,Menteri Sosial Indonesia,ke-22,17 Maret 1993,14 Maret 1998,Soeharto,Haryati Soebadio,Siti Hardijanti Rukmana,,,,,,,,,,,,,,,,,,,,,,,,,,,,,,,,,,,,,,,,,,"Tulungagung, Jawa Timur, Hindia Belanda",,,Indonesia,,Letjen TNI (Purn.) Soeweno,,,Islam,,,,,,,,,,,Brigjen TNI (Purn.) dr. H. Koesen Hirohoesodo (Ayah),,,,,,,,,,,,,,,,,,,,,,,,,,,,,,,,,,,,,,,,,,,,,,,,,,,,,,,,,,,,,,,,,,,,,,,,,,,,,,,,,,,,,,,,,,,,,,,,,,,,,,,,,,,,,,,,,,,,,,,,,,,,,,Politisi,,,,,,,,,,,,,,,,,,,,,,,,,,,,,,,,,,,,,,,,,,,,,,,,,,,,,,,,,,,,,,,,,,,,,,,,,Endang Kusuma Inten Soeweno
Bernardus Sugiarta Muljana,,Bernardus Sugiharta Muljana,Bernardus Sugiarta Muljana - Fifth Development Cabinet.jpg,,Daftar Wakil Menteri Perencanaan Pembangunan Nasional Indonesia  Menteri Muda Perencanaan Pembangunan Nasional,ke-1,23 Maret 1988,11 Maret 1993,Soeharto,"tidak ada, jabatan baru",Lukita Dinarsyah Tuwo,,,,,,,,,,,,,,,,,,,,,,,,,,,,,,,,,,,,,,,,,,"Yogyakarta, DI Yogyakarta, Hindia Belanda",,"Jakarta, DKI Jakarta, Indonesia",Indonesia,,,,,Katolik,,,,,,,,,,,,,,,,,,,,,,,,,,,,,,,,,,,,,,,,,,,,,,,,,,,,,,,,,,,,,,,,,,,,,,,,,,,,,,,,,,,,,,,,,,,,,,,,,,,,,,,,,,,,,,,,,,,,,,,,,,,,,,,,,,,,,,,,,,,,,,,,,,,,,,,,,,,,,,200px,,,,,,,,,,,,,,,,,,,,,,,,,,,,,,,,Universitas Indonesia,,,,,,,,,,,,,,,,,,,,Bernardus Sugiarta Muljana
Maraden Panggabean,Jenderal TNI (Purn.),,"Maraden Panggabean, Irian Barat dari Masa ke Masa, Preface.jpg",Maraden Panggabean Tahun 1971,Daftar Ketua Dewan Pertimbangan AgungKetua Dewan Pertimbangan Agung Republik Indonesia,ke-8,1983,1993,Soeharto,Idham Chalid,Sudomo,"Menteri Koordinator Bidang Politik, Hukum, dan Keamanan Republik IndonesiaMenteri Koordinator Bidang Politik dan Keamanan Republik Indonesia",ke-1,29 Maret 1978,19 Maret 1983,,Jabatan baru,Surono Reksodimedjo,Panglima Tentara Nasional IndonesiaPanglima Angkatan Bersenjata Republik Indonesia,ke-6,28 Maret 1973,17 April 1978,,Soeharto,M. Jusuf,9 September 1971,29 Maret 1978,,Soeharto,M. Jusuf,Wakil Panglima Tentara Nasional Indonesia  Wakil Panglima Angkatan Bersenjata Republik Indonesia,ke-2,9 September 1971,28 Maret 1973,,A. H. Nasution,Sumitro,19 November 1969,9 September 1971,,Soeharto,Soemitro,Kepala Staf TNI Angkatan Darat,ke-8,1 Mei 1967,25 November 1969,,,,Soeharto,Umar Wirahadikusumah,,"Pansur Napitu, Tarutung, Keresidenan Tapanuli",,"Jakarta, Indonesia",,,Meida Saimima Matiur br. Tambunan,,,,Signature of Maraden Panggabean.svg,,,25px  TNI Angkatan Darat,1945—1978,25px  Jenderal TNI,,Infanteri,Revolusi Nasional IndonesiaKonfrontasi Indonesia–MalaysiaInvasi Indonesia ke Timor Timur,,,,ke-2,,,,,,,,,,,,,,,,,,,,,,,,,,,,,,,,,Menteri Pertahanan Republik IndonesiaMenteri Pertahanan dan Keamanan Indonesia,,,,,,Komando Operasi Pemulihan Keamanan dan KetertibanPanglima Komando Operasi Pemulihan Keamanan dan Ketertiban,,,29 Mei 1967,,,,,,Maraden Saur Halomoan Panggabean,,,,,,,,,,,,,,,,,,,Umar Wirahadikusumah,,,,,,,,,,,,,,,,,,,,,,,,,,,,ke-14,,,16 Agustus 1966,,,,,,,,,,,,,,,,,,12150,,,,,,Gatot Soebroto,,Tentara,,,,,,,,,,,,,,,,,,,,,,,,,,,,,,,,,,,,,,,,,,,,,,,,,,,,,,,,,,,,,,,Wakil Kepala Staf TNI Angkatan Darat,,,,,,ke-3,,,,Maraden Panggabean
R. Hartono,,,Jenderal TNI R. Hartono.png,,Daftar Menteri Dalam Negeri IndonesiaMenteri Dalam Negeri Indonesia,ke-21,16 Maret 1998,21 Mei 1998,Soeharto,Yogie Suardi Memet,Syarwan Hamid,Daftar Menteri Penerangan IndonesiaMenteri Penerangan Indonesia,ke-23,17 Maret 1997,16 Maret 1998,Soeharto,Harmoko,Alwi Dahlan,Kepala Staf TNI Angkatan Darat,ke-18,13 Februari 1995,13 Juni 1997,,Wismoyo Arismunandar,Wiranto,1993,1994,,Soekarto,Moetojib,,,,,,,,,,,,,,,,,,,,,,,"Pamekasan, Madura, Hindia Belanda",,,Indonesia,Partai Karya Peduli Bangsa,Oetari,1. Himawan Sukmadianto 16-10-19642. Rudy Chandra Satriawan 12-11-19683. Torry Widyantoro 26-09-1971/ 2003 (Alm)4. Yudha Bramantia 18-01-1973,TNI  Politisi,,,,,25px TNI Angkatan Darat,1962—1997,25px Jenderal TNI,,Kavaleri,,,R. Osman Prawiro Asmoro (Bapak)R.A. Soekarni (Ibu),,,,,,,,,,,,,,,,,,,,,,,,,,,,,,,,,,,Gubernur Lemhannas,,,,,,,,,,,,,,,,,,,,,,,,,,,,,,,,,,,,,,,,,,,,,,,,,,,,,,,,,,,,,,ke-8,,,,,,,,,,,,,,,,,,,,,19067,,,,,,,,,,,,,,,,,,,,,,,,,,,,,,,,,,,,,,,,,,,,,,,,,,,,,,,,,,,,,Akademi Militer Nasional (1962),,,,,,,,,,,,,,,,,,,,R. Hartono
Soemitro,,Soemitro,"Soemitro, Riwayat Hidup Anggota-Anggota Majelis Permusyawaratan Rakyat Hasil Pemilihan Umum 1971, p1010.jpg",Jenderal Soemitro,Wakil Panglima Tentara Nasional IndonesiaWakil Panglima Angkatan Bersenjata Republik Indonesia,ke–3,9 September 1971,2 Maret 1974,Soeharto,Maraden Panggabean,Surono Reksodimedjo,,,,,,,,,,,,,,,,,,,,,,,,,,,,,,,,,,,,,,,,,,"Probolinggo, Jawa Timur",,Jakarta,,,,,,,,,,,1943—1974,25px|  Jenderal TNI,,,Revolusi Nasional Indonesia,,,,,Panglima,,,,,,,Hamengkubuwono IX,,,,,,,,,,,,,,,,,,,,,,,,,,,,,,,,,Jenderal TNI (Purn.) Soeharto,,,,,,,,,,,,,,,,,,,,,,,,,,,,,,,,,,,,,,,9 September 1971,,,,,,,,,,,,,,,,,,,Komando Operasi Pemulihan Keamanan dan Ketertiban Panglima Komando Keamanan dan Ketertiban,,,,,,,,,,,,,,,ke-3,,,,,,,,,,Tentara,,,,,,,,,,,,,,Soeharto,,,,,,,,,,,,,,,,,,,,,,,,,,,,,,,,,,,,,,,,,,,,,,Maraden Panggabean,,,,,,,,,,,SoehartoMaraden Panggabean,2 Maret 1974,Soemitro
Theo L. Sambuaga,,Theo Leo Sambuaga,Theo_sambuaga.jpg,,Daftar Menteri Perumahan Rakyat IndonesiaMenteri Negara Perumahan Rakyat dan Permukiman,ke-4,23 Mei 1998,27 September 1999,Bacharuddin Jusuf Habibie,Akbar Tanjungsebagai Menteri Negara Perumahan Rakyat dan Permukiman,Muhammad Yusuf Asy'arisebagai Menteri Negara Perumahan Rakyat (2004),Daftar Menteri Tenaga Kerja dan Transmigrasi IndonesiaMenteri Tenaga Kerja Indonesia,ke-19,14 Maret 1998,21 Mei 1998,Soeharto,Abdul Latief,Fahmi Idris,,,,,,,,,,,,,,,,,,,,,,,,,,,,,,,,,,,"Manado, Sulawesi Utara, Indonesia",,,Indonesia,,Erna Sambuaga,Eddy Khrisna Patria SambuagaJerry Adithya Ksatria Sambuaga,,Kristen Protestan,,,,,,,,,,,R. Soekardi (mertua),,,,,,,,,,,,,,,,,,,,,,,,,,,,,,,,,,,,,,,,,,,,,,,,,,Theo L. Sambuaga,Bacharuddin Jusuf Habibie,,,,,,,,,,,,,,,,,,,,,,Kabinet Pembangunan VIIKabinet Reformasi Pembangunan,,,,,,,,,,,,,,,,,,,,,,,,,,,,,,,,,,,,,,,,,,,,,,,,,,,,,Politikus,,,,,,,,,,,,,,,,,,,,,,,,,,,,,,,,,,,,,,,,,,,,,,,,,,,,,,,,,,,,,,,,,,,,,,,,,Theo L. Sambuaga
Mohammad Natsir,,Mohammad Natsir,Mohammad Natsir 1950s.jpg,,Perdana Menteri Indonesia,ke-5,"5 September 1950Feith, Herbert. The Decline of Constitutional Democracy in Indonesia. hal 150.","26 April 1951Feith, Herbert. The Decline of Constitutional Democracy in Indonesia. hal 168.",Soekarno,Abdoel Halim,Sukiman Wirjosandjojo,Menteri Penerangan Indonesia,ke-2,12 Maret 1946,26 Juni 1947,Soekarno,Amir Sjarifuddin,Setiadi Reksoprodjo,,,29 Januari 1948,4 Agustus 1949,Soekarno,Sjahbudin Latif,Syafruddin Prawiranegara,,,,,,,,,,,,,,,,,,,,,,,,,,,,"Alahan Panjang, Lembah Gumanti, Solok, Sumatera Barat, Hindia Belanda",,"Jakarta, Indonesia",Indonesia,(Masyumi),,6,Politikus,,,,,,,,,,,,,,,,,,,,,,,,,,,,,,,,,,,,,,,,,,,,,,,,,,,,,,,,,,,,,,,,,,,,,,,,,,,,,,,,,,,,,,,,,,,,,,,,,,,,,,,,,,,,,,,,,,,,,,,,,,,,,,,,,,,,,,,,,,,,,,,,,,,,,,,,,,,,,,,,,,,,,,,,,,,,,,,,,,,,,,,,,,,,,,,,,,,,,,,,,,,,,,,,,,,Mohammad Natsir
Filomeno Hornay,,,,,Ketua Dewan Konsultatif UNTAS,,16 Juli 2016,,,,,,,,,,,,,,,,,,,,,,,,,,,,,,,,,,,,,,,,,,,,,,"Fohorem, Cova Lima, Timor Portugis",,,,,Maria I. Alice Assis,,Pensiunan PNS,Katolik,,,,,,,,,,,,,,,,,,,,,,,,,,,,,,,,,,,,,,,,,,,,,,,,,,,,,,,,,,,,,,,,,,,,,,,,,,,,,,,,,,,,,,,,,,,,,,,,,,,,,,,,,,,,,,,,,,,,,,,,,,,,,,,,,,,,,,,,,,,,,,,,,,,,,,,,,,,,,,,,,,,,,,,,,,Filomeno de Jesus Hornay,,,,,,,,,,,,,,,,,,,,"Lincoln University, New Zealand",,,,,,,,,,,,,,,,,,,,Filomeno Hornay
Mohammad Sadli,,,M_sadli.jpg,,Menteri Pertambangan Indonesia,ke-6,28 Maret 1973,28 Maret 1978,Soeharto,Sumantri Brodjonegoro,Soebroto,,,,,,,,,,,,,,,,,,,,,,,,,,,,,,,,,,,,,,,,,,"Sumedang, Jawa Barat, Hindia Belanda",,"Jakarta, Indonesia",Indonesia,,Prof. Dr. Saparinah Sadli,,,Islam,,,,,,,,,,,,,,,,,,,,,,,,,,,,,,,,,,,,,,,,,,,,,,,,,,,,,,Soebroto,,,,,,,,,,,,,,,,,,,,,,,,,,,,,,,,,,,,,,,11 September 1971,,,,,,,,,,,,,,,,,,,Menteri Tenaga Kerja Indonesia,,,,,,,,,,,,,,,ke-13,,,,,,,,,,Ekonom,,,,,,,,,,,,,,Soeharto,,,,,,,,,,,,,,,,,,,,,,,,,,,,,,,,,,,,,,,,,,,,,,Mursalin Daeng Mamangung,,,,,,,,,,,,28 Maret 1973,Mohammad Sadli
Setya Novanto,,Setya Novanto,"Setya Novanto, Ketua DPR RI.jpg",,Ketua Dewan Perwakilan Rakyat,ke-16,30 November 2016,11 Desember 2017,Joko Widodo,Ade Komarudin,Fadli Zon (Pelaksana Tugas)Bambang Soesatyo,Ketua Umum Partai Golongan Karya,ke-10,17 Mei 2016,13 Desember 2017,,Aburizal Bakrie,Airlangga Hartarto,Anggota Dewan Perwakilan Rakyat Republik Indonesia,,1 Oktober 1999,11 Desember 2017,,,Imanuel Ekadianus Blegur,,,,,,,,,,,,,,,,,,,,,,,,,,,,"Bandung, Jawa Barat, Indonesia",,,,Partai Golongan Karya,"Luciana Lily Herliyanti  Deisti Astriani Tagor, S.H.",Pernikahan dengan Luciana Lily Herliyanti: 2Pernikahan dengan Deisti Astriani Tagor: 2,,,,,,,,,,,,,,,,,,,,,,,,,,"Timor TimurAnggota DPR-RI 1999-2004, diakses 29 Desember 2021.(1999—2004)https://id.quora.com/Timor-Timur-lepas-dari-Indonesia-pada-Oktober-1999-Apakah-ini-memengaruhi-posisi-anggota-DPR-periode-1999-2004-yang-berasal-dari-daerah-pemilihan-Timor-Timur?ch=10&oid=32927070&share=06f96207&srid=ewB6U&target_type=questionNusa Tenggara Timur II(2004—2017)",,,,,,,,,,,,,,,,,,,,,,,,,,,,,,Ade Komarudin,,,,,,,,,,,,,,,,,,,,,,,,,,,,,,,,,,,,,,,2 Oktober 2014,,,,,,,,,,,,,,,,,,,,,,,,,,,,,,,,,,,,,Fadli ZonAgus HermantoTaufik KurniawanFahri Hamzah,,,,,,,Politisi,,,,,,,,,,,,,,Susilo Bambang Yudhoyono  Joko Widodo,,,,,,,,,,,,,,,,,,,,,,,,,,,,,,,,,,,,,,,Universitas Katolik Widya Mandala SurabayaUniversitas Trisakti,,,,,,,Marzuki Alie,,,,,,,,,,,,16 Desember 2015,Setya Novanto
Syarwan Hamid,,,"Syarwan Hamid, The DPR-RI Stance on the Reform Process and the Resignation of President Soeharto, p39.jpg",,Menteri Dalam Negeri Indonesia,ke–22,23 Mei 1998,27 September 1999,B. J. Habibie,R. Hartono,Soerjadi Soedirdja,,,,,,,,,,,,,,,,,,,,,,,,,,,,,,,,,,,,,,,,,,"Dusun Pusaka, Siak, Masa pendudukan Jepang",,"Cimahi, Jawa Barat, Indonesia",,Golkar  Perindo (2015),"Hj. Endang Agustini, S.I.P.",,Tentara  Politikus,,,,,25px TNI Angkatan Darat,1966–1996,25px Letnan Jenderal TNI,,Infanteri,Pemberontakan di Aceh,,,,,,,,,,,,,,,,,,,,,,,,,,,,,,,,,,,,,,,,,,,,,,,,,,,,,,,,,,,,,,,,,,,,,,,,,,,,,,,,,,,,,,,,,,,,,,,,,,,,,,,,,,,,,,,,,,,,,,,,20755,,,,,,,,,,,,,,,,,,,,,,,,,,,,,,,,,,,,,,,,,,,,,,,,,,,,,,,,,,,,,Akademi Militer (1966),,,,,,,,,,,,,,,,,,,,Syarwan Hamid
Osa Maliki Wangsadinata,,Osa Maliki Wangsadinata,"Osa Maliki, Hasil Rakjat Memilih Tokoh-tokoh Parlemen (Hasil Pemilihan Umum Pertama - 1955) di Republik Indonesia, p75.jpg",,,,,,,,,,,,,,,,,,,,,,,,,,,,,,,,,,,,,,,,,,,,,,,,,,"Padalarang, Bandung Barat",,"Semarang, Jawa Tengah",Indonesia,20px Partai Nasional Indonesia,,,,Islam,,,,,,,,,,,,,,,,,,,,,,,,,,,,,,,,,,,,,,,,,,,,,,,,,,,,,,,,,,,,,,,,,,,,,,,,,,,,,,,,,,,,,,,,,,,,,,,,,,,,,,,,,,,,,,Anggota  Dewan Perwakilan Rakyat Republik Indonesia  Ketua Partai Nasional Indonesia Osa-Usep  Digulis,,,,,,,,,,,,,,,,,,,,,,"TMP Cikutra, Bandung, Jawa Barat",,,,,,,,,,,,,,,,,,,,,,,,,,,,,,,,,,,,,,,,,,,,,,,,,,,,,,,,,,,,,,,,,,,,,,,,,,,,,,Osa Maliki Wangsadinata
M. Jusuf,,,Jenderal TNI M Jusuf.png,,Daftar Menteri Pertahanan IndonesiaMenteri Pertahanan Keamanan Indonesia,ke-15,29 Maret 1978,19 Maret 1983,Soeharto,Maraden Panggabean,Poniman,Menteri Perindustrian Indonesia,ke-9,6 Juni 1968,28 Maret 1978,Soeharto,Ashari DanudirdjoMuhammad Sanusi,A.R. Soehoed,Menteri Perdagangan Indonesia,ke-19,11 Oktober 1967,6 Juni 1968,Soekarno,Ashari Danudirdjo,Sumitro Djojohadikusumo,21 Februari 1966,25 Juli 1966,Soekarno,Hadi Thayeb,Suharnoko Harbani,Menteri Perindustrian Ringan Indonesia,,27 Agustus 1964,21 Februari 1966,Soekarno,Tidak ada,Suharnoko Harbani,25 Juli 1966,17 Oktober 1967,Soekarno,Suharnoko Harbani,Ashari Danudirdjo,Panglima Angkatan Bersenjata Republik Indonesia,ke-7,29 Maret 1978,19 Maret 1983,Soeharto,,,Maraden Panggabean,Leonardus Benyamin Moerdani,,"Kajuara, Bone, Celebes, Hindia Belanda",,"Makassar, Sulawesi Selatan, Indonesia",,Independen,Elly Saelan,1,"Tentara, Politikus, Dokter",,,,,25px TNI Angkatan Darat,1945–1983,25px Jenderal TNI,,Infanteri,,,,,,,,,,,,,,,,,,,,,,,,,,,,,,,,,,,,,,Menteri Perindustrian Dasar Indonesia,,,,,,,,,,,,,,,Andi Muhammad Jusuf Amir,,,,,,,,,,,,,,,,,,,,,,,,,,,,,,,,,,,,,,,,,,,,,,,,,,,,,,,,,,,,,,,,,,,,,,,,,,,,,,,,,,,,,,,,,,,,,,,,,200px,,,,,,,,,,,,,,,,,,,,,,,,,,,,,,,,,,,,,,,,,,,,,,,,,,,,M. Jusuf
Soegiarto (militer),,Soegiarto,"Wali_Kota_Jogja,_Soegiarto.jpg",Soegiarto saat menjabat Wali kota Yogyakarta,,,,,,,,,,,,,,,,,,,,,,,,,,,,,,,,,,,,,,,,,,,,,,,,,,,,,,,,,,,,,25px TNI Angkatan Darat,,25px Mayor Jenderal TNI,,Infanteri (Kopassandha),,,,,,,,,,,,,,,,,,,,,,,,,,,,,,,,,,,,,,,,,,,,,,Djatmikanto Danumartono,,,,,,,,,,,,,,Hamengkubuwana IX,,,,,,,,,,,,,,,,,,,,,,,,,1981,,,,,,,,,,,,,,,,,,,Wali Kota Yogyakarta,,,,,,,,,,,,,,,,,,,,,,,,,,,,,,,,,,,,,,,,,,,,,,,,,,,,,,,,,,,,,,,,,,,,,,,,,,,,,,,,,,,,,H. Ahmad,,,,,,,,,,,,1986,Soegiarto (militer)
Dorodjatun Kuntjoro-Jakti,Prof. (Em) Drs.,,"Dorodjatun Kuntjoro-Jakti, Duta Besar RI untuk Amerika Serikat (cropped).jpg",,Menteri Koordinator Bidang Perekonomian Republik Indonesia,ke-10,10 Agustus 2001,20 Oktober 2004,Megawati Soekarnoputri,Burhanuddin Abdullah,Aburizal Bakrie,,,,,,,,,,,,,,,,,,,,,,,,,,,,,,,,,,,,,,,,,,"Rangkasbitung, Banten, Hindia Belanda",,,Indonesia,Non partisipan,Emiwaty (istri),,,Islam,,,,,,,,,,,,,,,,,,,,,,,,,,,,,,,,,,,,,,,,,,,,,,,,,,,,,,,,,,,,,,,,,,,,,,,,,,,,,,,,,,,,,,,,,,,,,,,,,,,,,,,,,,,,,,,,,"MA, Ph.D.",,,,,,,,,,,,,,,,,,,,,,,,Ekonom,,,,,,,,,,,,,,,,,,,,,,,,,,,,,,,,,,,,,,,Menteri Koordinator Bidang Perekonomian,,,,,,,,,,,,,,"Universitas Indonesia  Universitas California, Berkeley",,,,,,,,,,,,,,,,,,,,Dorodjatun Kuntjoro-Jakti
Mohammad Nazir,Laksamana Muda TNI (Purn.),,"Commodore M Nazir, Jalesveva Jayamahe, p215.jpg",,Kepala Staf TNI Angkatan LautPanglima Angkatan Laut RI,ke-2,6 Februari 1946,8 Mei 1948,Soekarno,Mas Pardi,R. Soebijakto,Menteri Perhubungan IndonesiaMenteri Perhubungan Laut Indonesia,ke-11,9 April 1957,10 Juli 1959,Soekarno,Sjuchjar Tedjasukmana,DjatikusumoAbdoelmoettalip DanoeningratR. Iskandar,,,,,,,,,,,,,,,,,,,,,,,,,,,,,,,,,,,"Maninjau, Agam, Hindia Belanda",,Jakarta,Indonesia,,,,Tentara,Islam,,,,28px TNI Angkatan Laut,1938 - 1965,25px Laksamana Muda TNI,,Korps Pelaut,,,,,,,,,,,,,,,,,,,,,,,,,,,,,,,,,,,,,,,,,,,,,,,,,,,,,,,,,,,,,,,,,,,,,,,,,,,,,,,,,,,,,,,,,,,,,,,,,,,,,,,,,,,,,,,,,,Sukardan,,,,,,,,,,,,,,,,,,,,,,,,,,,,,,,,,,,,,,,,,,,,,,,,,,,,,,,,,,,,,,,,,,,,,,,,,,,,,,,,,,,,,,,,Mohammad Nazir
Abdul Latief (pengusaha),,Abdul Latief,Sixth Development Cabinet Poster (Abdul Latief).jpg,,"Menteri Pariwisata, Seni, dan Budaya Indonesia",ke-5,16 Maret 1998,21 Mei 1998,Soeharto,Joop Ave,Marzuki Usman,Menteri Tenaga Kerja dan Transmigrasi Indonesia,ke-18,17 Maret 1993,14 Maret 1998,Soeharto,Cosmas Batubara,Theo L. Sambuaga,,,,,,,,,,,,,,,,,,,,,,,,,,,,,,,,,,,"Banda Aceh, Aceh, Hindia Belanda",,,Indonesia,,Nursyamsiah  Donna Louisa Maria,Medina Latief Harjani  Dipo Latief,,Islam,,,,,,,,,,,,,,,,,,,,,,,,,,,,,,,,,,,,,,,,,,,,,,,,,,,,,,,,,,,,,,,,,,,,,,,,,,,,,,,,,,,,,,,,,,,,,,,,,,,,,,,,,,,,,,,,,,,,,,,,,,,,,,,,,,,,,,,,,Pengusaha,,,,,,,,,,,,,,,,,,,,,,,,,,,,,,,,,,,,,,,,,,,,,,,,,,,,,Akademi Pimpinan Perusahaan JakartaUniversitas Krisnadwipayana,,,,,,,,,,,,,,,,,,,,Abdul Latief (pengusaha)
Daoed Joesoef,,,Daoed Joesoef portrait.jpg,,,,,,,,,,,,,,,,,,,,,,,,,,,,,,,,,,,,,,,,,,,,,,,,,,"Medan, Hindia Belanda",,"Jakarta, Indonesia",,,Sri Sulastri,Sri Sulaksmi Damayanti,,Islam,,,,,,,,,,,,,,,,,,,,,,,,,,,,,,,,,,,,,,,,,,,,,,,,,,,,,,Nugroho Notosusanto,,,,,,,,,,,,,,,,,,,,,,,,,,,,,,,,,,,,,,,29 Maret 1978,,,,,,,,,,,,,,,,,,,Menteri Pendidikan dan Kebudayaan Indonesia,,,,,,,,,,,,,,,Ke-17,,,,,,,,,,,,,,,,,,,,,,,,Soeharto,,,,,,,,,,,,,,,,,,,,,,,,,,,,,,,,,,,,,,,,,,,,,,Syarief Thayeb,,,,,,,,,,,,19 Maret 1983,Daoed Joesoef
Tommy Soeharto,,Tommy Soeharto,Tommy Suharto Central Aceh.png,,Ketua Umum Partai Berkarya ke-2,,11 Maret 2018,12 Juli 2020,,Neneng A. Tuty,Muchdi Purwoprandjono,Anggota MPR RI Fraksi Golkar,,1 Oktober 1992,21 Mei 1998,,,,,,,,,,,,,,,,,,,,,,,,,,,,,,,,,,,,,,"Jakarta, Indonesia",,,Indonesia,Partai Swara Rakyat Indonesia (2022–sekarang),,,,,,,,,,,,,,,,,,,,,,,,,,US$670 juta (2019),,,,,,,,,,,,,,,,,,,,,,,,,Soeharto,,,,,,,,,,,,,,Hutomo Mandala Putra,,,,,,,,,,,,,,,,,,,,,,,,,,,,,,,,,,,,,,,,,,,,,,,,,BLBI,,,,,,,,,,,,,,,,,,,,,,,,,,,Politisi,,,,,,,,,,,,,,,,,,,Siti Hartinah,,,,,,,,,,,,,,,,,,,,,,,,,,,,,,,,,,,,,,,,,,,,,,,,,,,,,,Tommy Soeharto
