Kasman Singodimedjo,,Kasman Singodimedjo,Kasman Singodimedjo.jpg,,Ketua Komite Nasional Indonesia Pusat,ke-1,29 Agustus 1945,17 Oktober 1945,,Tidak ada; jabatan baru,Soetan Sjahrir,Jaksa Agung Republik Indonesia,ke-2,8 November 1945,6 Mei 1946,Soekarno,Gatot Taroenamihardja,Tirtawinata,Menteri Muda Kehakiman Indonesia,ke-2,11 November 1947,29 Januari 1948,,Hadi,Denny Indrayana,,,,,,,,,,,,,,,,,,,,,,,,,,,,"Purworejo, Jawa Tengah, Hindia Belanda",,"Jakarta, Indonesia",Indonesia,,,,,,,,,,,,,,,,,,,,,,,,,,,,,,,,,,,,,,,,,,,,,,,,,,,,,,,,,,,,,,,,,,,,,,,,,,,,,,,,,,,,,,,,,,,,,,,,,,,,,,,,,,,,,,,,,,,,,,,,,,,,,,,,,,,,,,,,,"Taman Pemakaman Umum Tanah Kusir, Jakarta.",,,,,,,,,,,,,,,,,,,,,,,,,,,,,,,,,,,Amir Sjarifuddin,,,,,,,,,,,,,,,,,,,,,,,"STOVIA, MULO, GMS, AMS, HIS, ELS",,,,,,,,,,,,,,,,,,,,Kasman Singodimedjo
Hoegeng Iman Santoso,,Hoegeng Iman Santoso,"Police chief Hugeng Iman Santoso, Sekilas Lintas Kepolisian Republik Indonesia, p20.jpg",,Kepala Kepolisian Negara Republik IndonesiaKepala Staf Angkatan Kepolisian Republik Indonesia,ke-5,9 Mei 1968,2 Oktober 1971,SoekarnoSoeharto,Soetjipto Joedodihardjo,M. Hasan,Sekretaris Kabinet Indonesia,ke-2,27 Maret 1966,25 Juli 1966,Soeharto,Djamin Ginting,Sudharmono,Direktur Jenderal Imigrasi,ke-4,19 Januari 1961,22 Juni 1965,Soekarno,Notohatyanto,Widikdo Soedikman,,,,,,,,,,,,,,,,,,,,,,,,,,,,"Pekalongan, Jawa Tengah, Hindia Belanda",,"Jakarta, Indonesia",,,"Meriyati ""Merry"" Roeslani",3,,Islam,,,,25px Kepolisian Republik Indonesia,1944—1971,25px Jenderal Polisi,,,,,,,,,,,,,,,,,,,,,,,,,,,,,,,,,,,,,,,,,,,,,,,,,,,,,,,,,,,,,,,,,,,,,,,,,,,,,,,,,,,,,,,,,,,,,,,,,,,,,,,,,,,,,,,,,,,,,,,,,,,,,,,,,,,,,,,,,,,,,,,,,,,,,,,,200px,,,,,,,,,,,,,,,,,,,,,,,,,,,,,,,Rudy Wowor (menantu)Kasino(Keponakan),,,,,,,,,,,,,,,,,,,,,Hoegeng Iman Santoso
Umar Rukman,,Umar Rukman,"U. Rukman, Irian Barat dari Masa ke Masa, p102-103.jpg",,,,,,,,,,,,,,,,,,,,,,,,,,,,,,,,,,,,,,,,,,,,,,,,,,"Majalengka, Jawa Barat, Hindia Belanda",,,,,,,,,,,,25px TNI Angkatan Darat,19451969,25px Mayor Jenderal TNI,,Infanteri,,,,,,,,,,,,,,,,,,,,,,,,,,,,,,,,,,,,,,,,,,,,,,,,,,,,,,,,,,,,,,,,,,,,,,,,,,,,,,,,,,,,,,,,,,,,,,,,,,,,,,,,,,,,,,,,,,,,,,,,,11292,,,,,,,,,,,,,,,,,,,,,,,,,,,,,,,,,,,,,,,,,,,,,,,,,,,,,,,,,,,,,,,,,,,,,,,,,,,,,,,,,Umar Rukman
Sugiyono (politikus),,Sugiyono,,,Wakil Gubernur Papua,ke-5,1983,1987,Soeharto,Izaac Hindom,Poedjono Pranyoto,Wali Kota Malang,ke-10,19 Juni 1973,1983,Soeharto,Indra Soedarmadji,Soeprapto,,,,,,,,,,,,,,,,,,,,,,,,,,,,,,,,,,,"Blitar, Jawa Timur, Indonesia",,"Malang, Jawa Timur, Indonesia",,(1988-2004),Egni Rumambi,"5, termasuk Eddy Rumpoko",,,,,,,,,,,,,,,,,,,,,,,,,,,,,,,,,,,,,,,,,,,,,,,,,,,,,,,,,,,,,,,,,,,,,,,,,,Izaac Hindom,,,,,,,,,,,,,,,,,,,,,,,,,,,,,,,,,,,,,,,,,,,,,,,,,,,,,,,,,,,,,,,,,,,,,,,,,,,,,,R.P. Mohammad NoerSoenandar Prijosoedarmo,,,,,,,,210px,,,,,,,,,,,,,,,,,,,,,,,,,,,,,,,,,,,,,,,,,,,,,,,,,,,,Sugiyono (politikus)
Ibnu Sutowo,,Ibnu Sutowo,Ibnu Sutowo - Saatnya Saya Bercerita (Sampul Buku).jpg,,,,28 Maret 1966,25 Juli 1966,Soekarno,Armunanto,Slamet Bratanata,,,5 September 1955,2 Juli 1956,,Kolonel Inf Bambang Utoyo,Letkol Inf Barlian,Direktur Utama Pertamina,,9 Oktober 1968,3 Maret 1976,,Tidak diketahui,Piet Haryono,1986,1992,,Soeyoso Soemodimedjo,Siti Hardijanti Rukmana,,,,,,,,,,,,,,,,,,,,,,,"Yogyakarta, Hindia Belanda",,"Jakarta, Indonesia",,,Zaleha binti Sjafe'ie,Pontjo Sutowo dan 6 lainnya,TentaraDokter,Islam,,,,25px TNI Angkatan Darat,1946–1976,25px Letnan Jenderal TNI,,Kesehatan (CKM),,,,,,,,,,,,,,,,,,,,,,,,,,,,,,,,,,,,,,Ketua Umum Palang Merah Indonesia,,,,,,,,,,,,,,,,,,,,,,,,,,,,,,,,,,,,,,,,,,,,,,,,,,,,,,,,,,,,,,Ke-9,,,,,,,,,,,,,,,,,,,,,,,,,,,,,,,,,,,,,,,,,,,,,,,,,,,,,,,,,,,,,,,,,,,,,,,,,,,,,,,,,,,,,,,,,,,,,,,,,,,,,,Ibnu Sutowo
A.M. Fatwa,Kapten KKO (Purn.),Andi Mappetahang Fatwa,AM Fatwa.jpg,A.M. Fatwa sebagai anggota DPD RI,Ketua Badan Kehormatan DPD-RI,ke-3,9 Oktober 2014,11 Oktober 2016,,,,Wakil Ketua Majelis Permusyawaratan Rakyat Republik Indonesia,,1 Oktober 2004,30 September 2009,,,,Wakil Ketua Dewan Perwakilan RakyatBidang Kesejahteraan Rakyat,,1 Oktober 1999,30 September 2004,,,Zaenal Ma’arif,,,,,,,,,,,,,,,,,,,,,,,,,,,,"Bone, Sulawesi Selatan, Hindia Belanda",,"Jakarta, Indonesia",,,Ny. Noenoeng Noerdjanah,1. Dian Islamiati2. Diah Sakinah3. Ikar Fatahillah4. Rijalulhaq5. M. Averus,,Islam,,A. M. Fatwa,,25px TNI Angkatan Laut,1960–1970,25px Kapten,,KKO,,,,,,Ketua DPD,,,,,,,,,Akbar Tanjung,,,,,,,,,,Ketua MPR,,,,,,,,,,,"Jakarta, Indonesia",,,,,,,,,,,,,,,,,,,,,,,,,,,,,,,,,,,,,,,Ketua DPR,,,,,,,,,,1 Oktober 2009,,,,,,,,,,,,,,,,,,,Anggota DPD-RI dari DKI Jakarta,,Kanker hati,,,,,,,,Aksa Mahmud & Mooryati Soedibyo,,,,,,,,,,Taman Makam Pahlawan Nasional Utama Kalibata,,,,,TentaraPolitikus,,,Soetardjo SoerjogoeritnoKhofifah Indar ParawansaMuhaimin Iskandar,,,,,,,,,,,,,,,,,,200px,,,,,,,,,,,,,,,,,,,,,,,,,,Hidayat Nur Wahid,,,,,,Akademi Angkatan Laut (1960),,,,,,,,,,,,,,,,,,Irman Gusman,30 September 2014,A.M. Fatwa
Wiranto,,Wiranto,File:Wiranto2.jpg,,Ketua Dewan Pertimbangan Presiden Republik Indonesia,ke-5,13 Desember 2019,,Joko Widodo,Sri Adiningsih,,,,29 Oktober 1999,15 Februari 2000(sebagai Menteri Negara Koordinator Bidang Politik dan Keamanan),Abdurahman Wahid,Feisal Tanjung,"Soerjadi Soedirdja (sebagai Menteri Koordinator Bidang Politik, Sosial, dan Keamanan)",Menteri Pertahanan dan Keamanan Indonesia,ke-19,14 Maret 1998,20 Oktober 1999,SoehartoB. J. Habibie,Edi Sudrajat,Juwono Sudarsono,20 Desember 1997,26 Oktober 1999,SoehartoB. J. HabibieAbdurrahman Wahid,Feisal Tanjung,Widodo A. S.,Kepala Staf TNI Angkatan Darat,ke-19,13 Juni 1997,16 Februari 1998,,R. Hartono,Subagyo Hadi Siswoyo,31 Oktober 2016,6 November 2020,,Gita Wirjawan,Agung Firman Sampurna,Ketua Umum Partai Hati Nurani Rakyat,,21 Desember 2006,21 Desember 2016,,,,"Tidak ada, jabatan baru",Oesman Sapta Odang,,"Yogyakarta, Indonesia",,,Indonesia,,Rugaiya Usman,,,,,,,25px TNI Angkatan Darat,1968–1998,25px|  Jenderal TNI,,Infanteri,Operasi Seroja,,,,ke-13,,,,,,,,,,,,,,,,,,,,,,,,,,,,,,,"Jl. Palem Kartika No. 21, Bambu Apus, Cipayung, Jakarta",,Panglima Angkatan Bersenjata Republik Indonesia,RS Wirowijoto,,,,,Ketua Umum PBSIKetua Umum Persatuan Bulu Tangkis Seluruh Indonesia,,Mahfud MD,,,,,,,,,,,,,,,,,,,,,,,,www.wiranto.com www.facebook.com/wiranto.official twitter.com/wiranto1947,,,,,,,,,,,,,,,27 Juli 2016,,,,,,,,,,,,,,,ke-12,,,,"Daftar Menteri Koordinator Bidang Politik, Hukum, dan Keamanan IndonesiaMenteri Koordinator Bidang Politik, Hukum, dan Keamanan Indonesia",,,,,,,,,,,,,,,ke-6,,22166,,,,,,,,,,,,,,,,,,,,,,Joko Widodo,,,,,Suwarsijah,,,,,,,,,,,,,,,,,,,,,,,,,,,,,,,,,,,,,,,,,Luhut Binsar Pandjaitan,,,,,,,,,,,,20 Oktober 2019,Wiranto
Emanuel Melkiades Laka Lena,,Emanuel Melkiades Laka Lena,File:Anggota DPR Emanuel Melkiades Laka Lena.jpg,,Anggota Dewan Perwakilan Rakyat Republik Indonesia,,1 Oktober 2019,,Joko Widodo,,,,,,,,,,,,,,,,,,,,,,,,,,,,,,,,,,,,,,,,,,,,"Kupang, Nusa Tenggara Timur",,,,,Mindriyati Astiningsih,1,,,,,,,,,,,,,,,,,,,,,,,,,,,,,,,,Nusa Tenggara Timur II,,,,,,,,,,,,,,,,,,,,,,,,,,,,,,,,,,,,,,,,,,,,,,,,,,,,,,,,,,,,,,,,,,,,,,,,,,,,,,,,,,,,,,,,,,,,,,,,,,,,,,,,,,,,,,,,,,,,,,,,,,,,,,,,,,,,,,,,,,,,,,,,,,,,,,,,,,,,,,,,Universitas Sanata Dharma,,,,,,,,,,,,,,,,,,,,Emanuel Melkiades Laka Lena
Bob Hasan,,Bob Hasan,Bob Hasan.jpg,,Menteri Perindustrian dan Perdagangan Indonesia,ke-16,16 Maret 1998,21 Mei 1998,Soeharto,Tungki Ariwibowo,Rahardi Ramelan,,,,,,,,,,,,,,,,,,,,,,,,,,,,,,,,,,,,,,,,,,"Semarang, Jawa Tengah, Hindia Belanda",,Jakarta,Indonesia,,Pertiwi Hasan,2,,Islam,,,,,,,,,,,,,,,,,,,,,,,,,,,,,,,,,,,,,,,,,,,,,,,,,,,,,,,,,,,,,The Kian Seng,,,,,,,,,,,,,,,,,,,,,,,,,,,,,,,,,,,,,,,,,,,,,,,,,,,,,Kanker paru-paru,,,,,,,,,,,,,,,,,,,,,,,,,,,,,,,,,,,,,,,,,,,,,,,,,,,,,,,,,,,,,,,,,,,,,,,,,,,,,,,,,,,,,,,,,,,,,,,,Bob Hasan
Radius Prawiro,,,"Radius Prawiro, Gubernur Bank Indonesia.jpg","Potret resmi, 1966","Menteri Koordinator Bidang Ekonomi, Keuangan, Industri dan Pengawasan Pembangunan Indonesia",ke-4,23 Maret 1988,17 Maret 1993,Soeharto,Ali Wardhana,Saleh Afiff,Menteri Perdagangan dan Koperasi Indonesia,ke-20,28 Maret 1973,19 Maret 1983,Soeharto,Sumitro Djojohadikusumo,Rachmat SalehBustanil Arifin,Gubernur Bank Indonesia,ke-6,27 Maret 1966,5 April 1973,SoekarnoSoeharto,T. Jusuf Muda Dalam,Rachmat Saleh,17 Maret 1965,27 Maret 1966,Soekarno,Tidak ada; jabatan baru,Tidak ada; jabatan dihapuskan,,,,,,,,,,,,,,,,,,,,,,,"Yogyakarta, Hindia Belanda",,"München, Jerman",Indonesia,,Leoni Supit,,,Kristen Protestan,,,,,,,,,,,,,,,,,,,,,,,,,,,,,,,,,,,,,,,,,,,,,,Deputi Menteri Pemeriksa Keuangan Negara,,,,,,,,J.B. Sumarlin,,,,,,,,,,,,,,,,,,,,,,,,,,,,,,,,,,,,,,,19 Maret 1983,,,,,,,,,,,,,,,,,,,Menteri Keuangan Indonesia,,,,,,,,,,,,,,,ke-16,,,,,,,,,,"Ekonom, Politikus",,,,,,,,,,,,,,Soeharto,,,,,,,,,,,,,,,,,,,,,,,,,,,,,,,,,,,,,,,Universitas Indonesia,,,,,,,Ali Wardhana,,,,,,,,,,,,21 Maret 1988,Radius Prawiro
Haryono Suyono,"Prof., Dr.",Haryono Suyono,Sixth Development Cabinet Poster (Haryono Suyono).jpg,,Menteri Negara Koordinator Bidang Kesejahteraan Rakyat dan Pengentasan Kemiskinan Indonesia,ke-9,16 Maret 1998,20 Oktober 1999,SoehartoB. J. Habibie,Azwar Anas,Hamzah Haz,,,,,,,,Ketua Umum Persatuan Wredatama Republik Indonesia,,30 Januari 2011,21 Oktober 2021,,Ruchadi,Marzuki Usman,,,,,,,,,,,,,,,,,,,,,,,,,,,,"Pacitan, Jawa Timur, Hindia Belanda",,,,,Astuti Hasinah,Ria IndrastutiDewi PujiastutiFajar Wiryonodan Rina Mardiana (1968),,,,,,,,,,,,,,,,,,,,,,,,,,,,,,,,,,,,,,,,,,,,,,,,,,,,,,,,,,,,,,,,,,,,,,,,,,,,,,,,,,,,,,,,,,,,,,,,,,,,,,,,,,,,,,,,,,,"M.A, Ph.D.",,,,,,,,,,,,,Islam,,,,,,,,,,,Pengusaha  Menteri,,,,,,,,,,,,,,,,,,,,,,,Agama,,,,,,,,,,,,,,,,,,,,,,,,,,,,,,,,,,,,,,,,,,,,,,,,,,Haryono Suyono
Suhardiman,,Suhardiman,Suhardiman.jpg,"Suhardiman, Pendiri Sentral Organisasi Karyawan Seluruh Indonesia",,,,,,,,,,,,,,,,,,,,,,,,,,,,,,,,,,,,,,,,,,,,,,,,,"Surakarta, Jawa Tengah",,Jakarta,,,Sapartinah,,,,,,Indonesia,25px TNI Angkatan Darat,,25px Mayor Jenderal TNI,,,Revolusi Nasional Indonesia,,,,,,,,,,,,,,,,,,,,,,,,,,,,,,,,,,,,,,,,,,,,,,,,,,,,,,,,,,,,,,,,,,,,,,,,,,,,,,,,,,,,,,,,,,,,,,,,,,,,,,,,,,,,,,,,,,,,,,,,,,,,,,,,,,,,,,,,,,,,,,,,,,,,,230px,,,,,,,,,,,,,,,,,,,,,,,,,,,,,,,,,,,,,,,,,,,,,,,,,,,,Suhardiman
Sudomo,Laksamana TNI (Purn.),,"Sudomo, 25 Tahun Pembangunan Pemerintah Orde Baru.jpg",Sudomo sebagai Ketua Dewan Pertimbangan Agung,Ketua Dewan Pertimbangan Agung Republik Indonesia,ke-9,1993,1998,Soeharto,Maraden Panggabean,Arnold Achmad Baramuli,Menteri Tenaga Kerja Indonesia,ke-16,19 Maret 1983,23 Maret 1988,Soeharto,Harun Zain,Cosmas Batubara,Daftar Wakil Panglima Tentara Nasional Indonesia  Wakil Panglima Angkatan Bersenjata Republik Indonesia,ke-5,17 April 1978,29 Maret 1983,Soeharto,Surono Reksodimedjo,Widodo Adi Sutjipto,5 April 1978,29 Maret 1983,Soeharto,Jenderal TNI (Purn.) Soeharto,Jenderal TNI Leonardus Benyamin Moerdani,Kepala Staf Komando Keamanan dan Ketertiban,,1973,1978,Soeharto,,,16 Desember 1969,26 Juni 1973,Soeharto,Moeljadi,R. Soebono,,,,,,,,,,,"Malang, Jawa Timur, Hindia Belanda",,"Jakarta, Indonesia",,,,4,,Islam,,,,25px TNI Angkatan Laut,1945—1983,25px|  Laksamana TNI,,Korps Pelaut,,,,,ke-6,,,,,,,,Try Sutrisno,,,,,,,,,,,,,,,,,,,,,,,"Jalan Sekolah Kencana IV, Pondok Indah, Jakarta Selatan",,Komando Operasi Pemulihan Keamanan dan Ketertiban Panglima Komando Keamanan dan Ketertiban,,,,,,Kepala Staf TNI Angkatan Laut,,Soesilo Soedarman,,,,,,,,Umar Wirahadikusumah,,,,,,,,,,,,,,,,,Hamengkubuwono IX,,,,,,,,,,,,,,23 Maret 1988,,,,,,,,,,,,,,,ke-5,,,,Menteri Koordinator Bidang Politik dan Keamanan Republik Indonesia,,Stroke,,,,,,,,,,,,,ke-3,,41/P,,,"Taman Makam Pahlawan Nasional Utama Kalibata, Jakarta, Indonesia",,,,,TNI,,,,,,,,,,,,,,Soeharto,Adam Malik,,,,,,,,,Try Sutrisno,,,,,,,,,,,Panglima Kopkamtib,,,,,Adam Malik,,,,,,,,,,,,,,,,,,Hamengkubuwono IX,,Surono Reksodimedjo,,,,,,Soeharto,,,,,,17 Maret 1993,Sudomo
Arifin Siregar,,Arifin Mohamed Siregarhttp://www.bloomberg.com/research/stocks/people/person.asp?personId=34052827&ticker=SIME:MK,File:Duta Besar Indonesia untuk Amerika Serikat Arifin Siregar.jpg,,Duta Besar Indonesia untuk Amerika Serikat,ke-13,1 Oktober 1993,21 November 1997,Soeharto,Abdul Rahman Ramly,Dorodjatun Kuntjoro-Jakti,Gubernur Bank Indonesia,ke-8,1983,1988,Soeharto,Rachmat Saleh,Adrianus Mooy,,,,,,,,,,,,,,,,,,,,,,,,,,,,,,,,,,,"Medan, Sumatra Timur, Hindia Belanda",,"Jakarta, Indonesia",Indonesia,,Adiati,3,,,Sign Arifin M. Siregar.png,,,,,,,,,,,,,,,,,,,,,,,,,,,,,,,,,,,,,,,,,,,,,,,,,,,,,Satrio Budihardjo Joedono,,,,,,,,,,,,,,,,,,,,,,,,,,,,,,,,,,,,,,,21 Maret 1988,,,,,,,,,,,,,,,,,,,Menteri Perdagangan Indonesia,,,,,,,,,,,,,,,ke-22,,,,,,,,,,,,,,,,,,,,,,,,Soeharto,,,,,,,,,,,,,,,,,,,,,,,,,,,,,,,,,,,,,,,Nederlandsche Economische Hogeschool,,,,,,,Rachmat Saleh,,,,,,,,,,,,17 Maret 1993,Arifin Siregar
G.A. Siwabessy,,,"G. A. Siwabessy, Menkes - Anggota Kabinet Pembangunan II.jpg","Portret Resmi, 1973",Kementerian Kesehatan IndonesiaMenteri Kesehatan,ke-9,25 Juli 1966,29 Maret 1978,SoekarnoSoeharto,Satrio,Suwardjono Surjaningrat,,,,,,,,,,,,,,,,,,,,,,,,,,,,,,,,,,,,,,,,,,"Ullath, Saparua Timur, Maluku Tengah, Hindia Belanda",,"Jakarta, Indonesia",,Independen,,,,Kristen Protestan,,,,,,,,,,,,,,,,,,,,,,,,,,,,,,,,,,,,,,,,,Portret Resmi pada tahun 1973,,,,,,Enoch Siwabessy,,,,,,,,,,,,,,,,,,,,,,,,,,200px,,,,,,,,,,,,,,,,,,,,,,,,,,,,,,,,Prof. dr.,,,,,,,,,,,,,,,,,,,,,,,,,,,,,,,,"Ilmuwan, dokter, Politikus",,,,,,,,,,,,,,,,,,,Naatje Manuhutu,,,,,,,,,,,,,,,,,,,,,,,,,,,,,,,,,,,,,,,,,,,,,,,,,,,,,,G.A. Siwabessy
Bambang Trihatmodjo,,Bambang Trihatmodjo Soeharto,,,,,,,,,,Direktur Utama Bimantara Citra,,1981,1998,,jabatan baru,M. Tachril Sapi'ie,,,,,,,,,,,,,,,,,,,,,,,,,,,,,,,,,,,"Surakarta, Jawa Tengah",,,,Golongan Karya (sampai 1998)Partai Berkarya (sejak 2018),,Pernikahan dengan Halimah Agustina: Gendis Siti Hatmanti SoehartoPanji Adhikumoro SoehartoBambang Aditya Trihatmanto Soeharto Pernikahan dengan Mayangsari: Khirani Siti Hartina Trihatmodjo Soeharto,,,,,,,,,,,,,,,,,,,,,,,,,,,,,,,,,,,,,,,,,,,,Indonesia,,,,,Soeharto,,,,,,,,,,,,,,,,,,,,,,,,,,,,,,,,,,,,,,,,,,,,,,1 Oktober 1992,,,,,,,,,,,,,,,,,,,Anggota MPR RI Fraksi Golkar,,,,,,,,,,,,,,,,,,,,,,,,,Pengusaha,,,,,,,,,,,,,,,,,,,Siti Hartinah,,,,,,,,,,,,,,,,,,,,,,,,,,,,,,,,,,,,,,,,,,,,,,,,,,,,,21 Mei 1998,Bambang Trihatmodjo
Feisal Tanjung,,,Feisal Tanjung as Commander of the Armed Forces.jpg,,Menteri Koordinator Bidang Politik dan Keamanan Republik Indonesia,ke-5,16 Maret 1998,20 Oktober 1999,SoehartoBacharuddin Jusuf Habibie,Soesilo Soedarman,Wiranto,,,,,,,,Panglima Angkatan Bersenjata Republik Indonesia,ke-11,21 Mei 1993,12 Februari 1998,Soeharto,Edi Sudradjat,Wiranto,26 Juli 1992,15 Mei 1993,,Soedibyo Rahardjo,Herman Bernhard Leopold Mantiri,,,,,,,,,,,,,,,,,,,,,,,"Tarutung, Silindung, Keresidenan Tapanuli, Hindia Belanda",,"Jakarta, Indonesia",Indonesia,Non partisipan,dr. Masrowida Lubis,,,Islam,,,,25px TNI Angkatan Darat,1961–1998,25px Jenderal TNI,,Infanteri (Kopassus),,ICSA Awards 2008,,,,,,,,,,,,,,,,,,,,,,,,,,,,,,,,,,,,Kepala Staf Umum Tentara Nasional IndonesiaKepala Staf Umum Angkatan Bersenjata Republik Indonesia,,,,,,,,,,,,,,,,,,,,,,,,,,,,,,,,,,,,,,,,,,,,,,,,,,,,,,,,,,,,,,ke-6,,,,,,,,,,,,,,,,,,,,,,,,,,,,,Tentara,,,,,,,,,,,,,,,,,,,,,,,,,,,,,,,,,,,,,,,,,,,,,,,,,,,,,Akademi Militer Nasional (1961),,,,,,,,,,,,,,,,,,,,Feisal Tanjung
Sumantri Brodjonegoro,,,"Koningin op de tweede dag van het staatsbezoek, Bestanddeelnr 254-9019 (Soemantri Brodjonegoro).jpg",,Menteri Pendidikan dan Kebudayaan Indonesia,ke-15,28 Maret 1973,18 Desember 1973,Soeharto,Mashuri Saleh,Syarief Thayeb,Menteri Pertambangan Indonesia,ke-5,17 Oktober 1967,28 Maret 1973,Soeharto,Slamet Bratanata,Mohammad Sadli,Rektor Universitas Indonesia,ke-6,1964,1973,,Syarief Thayeb,Slamet Iman Santoso(Sebagai Pejabat Rektor),2 Maret 1959,1 November 1959,,Periode FT & FIPIA UI Bandung,,,,,,,,,,,,,,,,,,,,,,,,"Semarang, Jawa Tengah, Hindia Belanda",,"Jakarta, Indonesia",Indonesia,,,"3, termasuk Bambang Permadi Soemantri Brodjonegoro",,,,,,,,,,,,,,,,,,,,,,,,,,,,,,,,,,,,,,,,,,,,,,,,Presidium Institut Teknologi Bandung,,,,,,,,,,,,,,,,,,,,,,,,,,,,,,,,,,,,,,,,,,,,,,,,,,,,,,,,,,,,,,ke-1,,,,,,,,,,,,,,,,,,,,,,,,,,,,,Akademisi,,,,,,,,,,,,,,,,,,,,,,,,,,,,,,,,,,,,,,,,,,,,,,,,,,,,,Sekolah Tinggi Teknik BandungTechnische Universiteit Delft,,,,,,,,,,,,,,,,,,,,Sumantri Brodjonegoro
Oemar Seno Adji,,Oemar Seno Adji,Oemar_Seno_Adji.png,Potret Oemar Seno Adji sebagai Ketua Mahkamah Agung,Ketua Mahkamah Agung Republik Indonesia,ke-5,22 Januari 1974,9 Februari 1981,,Soebekti,Mudjono,,,,,,,,,,,,,,,,,,,,,,,,,,,,,,,,,,,,,,,,,,"Surakarta, Hindia Belanda",,,,,,Indriyanto Seno Adji,,,,,,,,,,,,,,,,,,,,,,,,,,,,,,,,,,,,,,,,,,,,,,,,,,,,,,,,Ali Said,,,,,,,,,,,,,,,,,,,,,,,,,,,Soeharto,,,,,,,,,,,,25 Juli 1966,,,,,,,,,,,,,,,,,,,Menteri Kehakiman Indonesia,,,,,,,,,,,,,,,ke-15,,,,,,,,,,,,,,,,,,,,,,,,Soekarno Soeharto,,,,,,,,,,,,,,,,,,,,,,,,,,,,,,,,,,,,,,,Universitas Gadjah Mada,,,,,,,Wirjono Prodjodikoro,,,,,,,,,,,,28 Maret 1973,Oemar Seno Adji
Achmad Tahir,Jenderal TNI (HOR) (Purn.),,Achmad Tahir - Fourth Development Cabinet.jpg,Potret Achmad Tahir,"Menteri Pariwisata, Pos, dan Telekomunikasi Indonesia",ke-2,19 Maret 1983,21 Maret 1988,Soeharto,S.H. SimatupangHamengkubuwono IX,Soesilo Soedarman,,,,,,,,,,,,,,,,,,,,,,,,,,,,,,,,,,,,,,,,,,"Kisaran, Sumatera Utara, Hindia Belanda",,"Rumah Sakit Medistra, Jakarta, Indonesia",,,Ny. Rooslila Simanjuntak,,,Islam,,,,25px TNI Angkatan Darat,1945—1973,25px Jenderal TNI,,Polisi Militer (CPM),Operasi Trikora,,,,,,,,,,,,,,,,,,,,,,,,,,,,,,,,,,,,,,,,,,,,,,,,,,,,,,,,,,,,,,,,,,,,,,,,,,,Kabinet Pembangunan IV,,,,,,,,,,,,,,,,,,,,,,,,,,,,,,,,,,,,,,,,,,,,,15431,,,"Taman Makam Pahlawan Nasional Utama Kalibata, Jakarta, Indonesia",,,,,Militer,,,,,,,,,,,,,,,,,,,,,,,,Umar Wirahadikusumah,,,,,,,,,,,,,,,,,,,,,,,,,,,,,,,,,,,,,,,,,,,,,,,,,Achmad Tahir
Muhammad Dahlan,,,Muhammad Dahlan.jpg,,Menteri Agama Indonesia,Ke-11,17 Oktober 1967,11 September 1971,Soeharto,KH. Saifuddin Zuhri,Prof.Dr.H.A. Mukti Ali,,,,,,,,,,,,,,,,,,,,,,,,,,,,,,,,,,,,,,,,,,"Pasuruan, Keresidenan Pasuruan, Hindia Belanda",,Indonesia,Indonesia,NU,,,,Islam,,,,,,,,,,,,,,,,,,,,,,,,,,,,,,,,,,,,,,,,,,,,,,,,,,,,,,,,,,,,,,,,,,,,,,,,,,,,,,,,,,,,,,,,,,,,,,,,,,,,,,,,,,,,,,,,,,,,,,,,,,,,,,,,,,,,,,,,,,,,,,,,,,,,,,,,,,,,,,,,,,,,,,,,,,,,,,,,,,,,,,,,,,,,,,,,,,,,,,,,,,,,,,,,,,Muhammad Dahlan
Adhyatma,,Adhyatma,Adhyatma - Fifth Development Cabinet.jpg,,Menteri Kesehatan Indonesia,ke-11,23 Maret 1988,11 Maret 1993,Soeharto,Suwardjono Surjaningrat,Sujudi,,,,,,,,,,,,,,,,,,,,,,,,,,,,,,,,,,,,,,,,,25 Mei 1932,"Semarang, Jawa Tengah, Hindia Belanda",2 Desember 1999 (umur 67),"Jakarta, Indonesia",Indonesia,,Siti Fatimah,3,,,,,,,,,,,,,,,,,,,,,,,,,,,,,,,,,,,,,,,,,,,,,,,,,,,,,,,,,,,,,,,,,,,,,,,,,,,,,,,,,,,,,,,,,,,,,,,,,,,,,,,,,,,,,,,,,,,,,,,,,,,,,,,,,,,,,,,,,,,Dokter,,,,,,,,,,,,,,,,,,,,,200px,,,,,,,,,,,,,,,,,,,,,,,,,,,,,,,,,,,,,,,,,,,,,,,,,,,,Adhyatma
Joop Ave,,Joop Ave,Sixth Development Cabinet Poster (Joop Ave).jpg,,"Menteri Pariwisata, Pos, dan Telekomunikasi Indonesia",ke-4,17 Maret 1993,16 Maret 1998,Soeharto,Soesilo Soedarman,Abdul Latief,,,,,,,,,,,,,,,,,,,,,,,,,,,,,,,,,,,,,,,,,,"Yogyakarta, Hindia Belanda",,Singapura,Indonesia,Non partisipan,,,,,,,,,,,,,,,,,,,,,,,,,,,,,,,,,,,,,,,,,,,,,,,,,,,,,,,,,,,,,,,,,,,,,,,,,,,,,,,,,,,,,,,,,,,,,,,,,,,,,,,,,,,,,,,,,,,,,,,,,,,,,,,,,,,,,,,,,,,,,Politikus,,,,,,,,,,,,,,,,,,,,,,,,,,,,,,,,,,,,,,,,,,,,,,,,,,,,,,,,,,,,,,,,,,,,,,,,,Joop Ave
Nugroho Notosusanto,Brigjen. TNI (Purn.) Prof. Dr. Raden Panji,,Nugroho Notosusanto - Fourth Development Cabinet.jpg,,,,,,,,,,,,,,,,Rektor Universitas Indonesia,Ke-8,1982,1985,,Mahar Mardjono,W. A. F. J. Tumbelaka(Sebagai Pejabat Rektor),,,,,,,,,,,,,,,,,,,,,,,,,,,,"Rembang, Jawa Tengah, Hindia Belanda",,"Jakarta, Indonesia",,,Irma Sawitri Ramelan,3,,,Nugroho Notosusanto's Signature.svg,,,25px TNI Angkatan Darat,,25px Brigadir Jenderal TNI,,,,,,,,,,,,,,,,,,,,,,,,,,,,,,,,,,,,,,,,,,,,,,,,Fuad Hassan,,,,,,,,,,,,,,,,,,,,,,,,,,,,,,,,,,,,,,,19 Maret 1983,,,,,,,,,,,,,,,,,,,Menteri Pendidikan dan Kebudayaan Indonesia,,,,,,,,,,,,,,,Ke-18,,,,,,,,,,Tentara  Akademisi,,,,,,,,,,,,,,Soeharto,,,,,,,,,,,,,,,,,,,,,,,,,,,,,,,,,,,,,,,Universitas Indonesia,,,,,,,Daoed Joesoef,,,,,,,,,,,,3 Juni 1985,Nugroho Notosusanto
Sofjan Wanandi,,Sofjan Wanandi,"Sofjan Wanandi, Ketum APINDO 2003-2014.jpg",,,,,,,,,,,,,,,,,,,,,,,,,,,,,,,,,,,,,,,,,,,,,,,,,,"Sawahlunto, Sumatera Barat, Hindia Belanda",,,,,Riantini Wanandi (The Gim Kiauw),Emmanuel Lestarto Wanandi  A Lukito Wanandi  Paulus Witarsa Wanandi,,,,,,,,,,,,,Jusuf Wanandi (Kakak),,,,,,,,,,,US$635 juta (2019),,,,,,,,,,,,,,,,,,,,,,,,,,,,,,,,Hariyadi Budi Santoso Sukamdani,,,,,,,,,,,,,,,,,,,,,,,,,,,,,,,,,,,,,,,2003,,,,,,,,,,,,,,,,,,,Daftar Ketua Umum Asosiasi Pengusaha Indonesia  Ketua Umum Asosiasi Pengusaha Indonesia,,,,,,,,,,,,,,,ke-5,,,,,,,,,,Pemilik Gemala Groupinvesting.businessweek.com. Sofjan Wanandi,,,,,,,,,,,,,,Megawati SoekarnoputriSusilo Bambang YudhoyonoJoko Widodo,,,,,,,200px,,,,,,,,,,,,,,,,,,,,,,,,,,,,,,,,Universitas Indonesia  Kolese Kanisius,Liem Gim To & Tjoa Gim Jong Nio,,,,,,Soeparwanto,,,,,,,,,,,,24 November 2014,Sofjan Wanandi
Yogi Supardi,Letnan Jenderal TNI (Purn.),Yogi Supardi,Ignatius Yogi Supardi.jpg,,Komandan Seskoad l ke-11,,1974,1976,,Mayjen TNI Sutanto Wiryoprasonto,Mayjen TNI E.W.P. Tambunan,,,,,,,,,,,,,,,,,,,,,,,,,,,,,,,,,,,,,,,,,,"Klaten, Jawa Tengah",,"(RSPAD) Gatot Soebroto, Jakarta Pusat, Indonesia",Indonesia,,,,,,,,,25px TNI Angkatan Darat,1948-1983,25px Letnan Jenderal TNI,,Artileri Medan,,,,,,,,,,,,,,,,,,,,,,,,,,,,,,,,,,,,,,,,,,,,,,,,,,,,,,,,,,,,,,,,,,,,,,,,,,,,,,,,,,,,,,,,,,,,,,,,,,,,,,,,,,,,,,,,,,,,,,,,,,,,,,,,,,,,,,,,,,,,,,,,,,,,,,,,,,,,,,,,,,,,,,,,,,,,,,,,,,,,,,Militaire Academie (MA) Jogya Angkatan I (1948),,,,,,,,,,,,,,,,,,,,Yogi Supardi
Mukti Ali,,,Mukti Ali.jpg,,Menteri Agama Indonesia,Ke-12,11 September 1971,29 Maret 1978,Soeharto,K.H. Muhammad Dahlan,Alamsyah Ratu Perwiranegara,,,,,,,,,,,,,,,,,,,,,,,,,,,,,,,,,,,,,,,,,,"Cepu, Blora, Keresidenan Rembang, Hindia Belanda",,"Yogyakarta, Indonesia",Indonesia,,,,,Islam,,,,,,,,,,,,,,,,,,,,,,,,,,,,,,,,,,,,,,,,,,,,,,,,,,,,,,,,,,,,,,,,,,,,,,,,,,,,,,,,,,,,,,,,,,,,,,,,,,,,,,,,,,,,,,,,,,,,,,,,,,,,,,,,,,,,,,,,,,,,,,,,,,,,,,,,,,,,,,180,,,,,,,,,,,,,,,,,,,,,,,,,,,,,,,,,,,,,,,,,,,,,,,,,,,,Mukti Ali
S.K. Trimurti,,,S K Trimurti 12 July 1947 KR.jpg,,Menteri Perburuhan Indonesia,Ke-1,3 Juli 1947,29 Januari 1948,Soekarno,Tidak ada,Kusnan,,,,,,,,,,,,,,,,,,,,,,,,,,,,,,,,,,,,,,,,,,"Boyolali, Indonesia",,"Jakarta, Indonesia",,,Sayuti Melik,2,"Guru, ekonom",,,,,,,,,,,,,,,,,,,,,,,,,,,,,,,,,,,,,,,,,,,,,,,,,,,,,,,,,,,,,,Soerastri Karma Trimoerti,,,,,,,,,,,,,,,,,,,,,,,,,,,,,,,,,,,,,,,,,,,,,,,,,,,,,,,,,,,,,,,,,,,,,,,,,,,,,,,,,,,,,,,,,,,,,,,,,,,,,,,,,,,,,,,,,,,,,,,,,,,,,,,,,Fakultas Ekonomi Universitas Indonesia,,,,,,,,,,,,,,,,,,,,S.K. Trimurti
Sintong Panjaitan,,Sintong Panjaitan,Danjen Kopassus Sintong Panjaitan.jpg,"Sintong Panjaitan, 1985",,,,,,,,Komandan Jenderal Komando Pasukan Khusus,ke-10,Mei 1985,Agustus 1987,,Wismoyo Arismunandar,Kuntara,,,,,,,,,,,,,,,,,,,,,,,,,,,,,,,,,,,"Tarutung, Sumatera, Hindia Belanda",,,Indonesia,,Lentina Napitupulu,,,Kristen Protestan,,,,25px TNI Angkatan Darat,1963—1991,25px Letnan Jenderal TNI,,Infanteri (Kopassus),Operasi DwikoraOperasi Seroja,,,,,,,,,,,,,,,,,,,,,,,,,,,,,,,,,,,Jakarta,,,,,,,,,,HBL Mantiri,,,,,,,Sintong Hamonangan Panjaitan,,,,,,,,,,,,,,,,,,,,,,,,,,,,,,,,12 Agustus 1988,,,,,,,,,,,,,,,,,,,Panglima Komando Daerah Militer IX/Udayana ke-13,,,,,,,,,,,,,,,,,19294,,,,,,,,TNI (Purnawirawan),,,,,,,,,,,,,,,,,,,,,,,,,,,,,,,,,,,,,,,,,,,,,,,,,,,,,Akademi Militer Nasional (1963),,,,,,,Djoko Pramono,,,,,,,,,,,,1 Januari 1992,Sintong Panjaitan
Ahmad Yunus Mokoginta,,Ahmad Junus Mokoginta,Danpuspomad Ahmad Yunus Mokoginta.jpg,,Komandan SSKAD,,12 Maret 1956,16 April 1958,,GPH Djatikoesoemo,Latief Hendraningrat,Panglima Teritorium VII/Indonesia Timur,,1950,1950,,"Tidak ada, jabatan baru",A.E. Kawilarang,Komandan Polisi Militer Daerah Jawa,,1949,1950,,Gatot Soebroto,Siswondo Parman,,,,,,,,,,,,,,,,,,,,,,,,,,,,"Kotamobagu, Sulawesi Utara",,Jakarta,,,Ny. Koriyati Mokoginta,9,,,,A.Y. Mokoginta,,25px TNI Angkatan Darat,1941 -,23px Letnan Jenderal TNI,,Polisi Militer (CPM),,,,,,,,,,,,,,,,,,,,,,,,,,,,,,,,,,,,,,,,,,,,,,GPH Djatikoesoemo,,,,,,,,,,,,,,,,,,,,,,,,,,,,,,,,,,,,,,,1 Oktober 1951,,,,,,,,,,,,,,,,,,,,,,,,,,,,,,,,,,,,,,,,,,,,,,,,,,,,,,,,,,,,,,,,,,,,,,,,,,,,,,,,,,,,,,,,,,,,,,,,,Akademi Militer Breda di Bandung (1941),,,,,,,"Tidak ada, jabatan baru",,,,,,,,,,,,8 April 1953,Ahmad Yunus Mokoginta
Mochamad Jasin,,Mochamad Jasin,LetJen Purn- M- Jasin - Mantan Wakasad Republik Indonesia 2013-10-05 15-56.jpg,,Wakil Kepala Staf TNI Angkatan Darat,,,,,,,Panglima Kodam VIII/Brawijaya,,,,,Brigjen TNI Soemitro,Brigjen TNI Wahono,Pangdam I/Iskandar Muda,,,,,Kolonel Inf Syamaun Gaharu,Kolonel Inf Nyak Adam Kamil,,,,,,,,,,,,,,,,,,,,,,,,,,,,"Sabang, Pulau Weh, Aceh, Hindia Belanda",,Jakarta,Indonesia,,Siti Abesanti,,,,,,,25px TNI Angkatan Darat,1944 - 1970,25px Letnan Jenderal TNI,,Infanteri,,,,,,,,1973,1 Oktober 1963,,,,,,,,,,,,,,,,,,,,,,,,,,,,,,,,,,,,,Letjen TNI Sayidiman Suryohadiprojo,,,,,,,,,,,,,,,,,,,,,,,,,,,,,,,,1967,,,,,,,,1970,,,,,,,,,,,,,,,,- Menciptakan perdamaian antara Pemerintah RI dengan DI/TII pimpinan Teungku Daud Beureu'eh- Penanda tangan Petisi 50- Inisiator Operasi Trisula,,,,,,,,,,,,,,,,,,,,,,,,,,,Militer- Wakil KSAD - Pangdam VIII Brawijaya- Pangdam I/Iskandar Muda,,,,,,,,,,,,,,,,,,,,,,,,,,,,,,,,,,10 September 1960,,,,,,,,,,,,,,1970,,,,,"Defence General Staff College, Wellington, India (1958)",Mochamad Iyas,,,,,,Letjen TNI Umar Wirahadikusumah,,,,,,,,,,,,,Mochamad Jasin
